asin_name,asin_value_usd,brand
Rubie's Costume Company DC Comics Super Girl Pet Tutu Dress,19.82,Rubie's Costume
Black & Decker Junior 14 Piece Toy Tool Belt Set,17.0,Black & Decker Junior
"amscan Metal Unity Candle Holder, 3 Ct.",62.16,
Fisher-Price Disney Toy Story 4 Jessie's Campground Adventure by Little People,17.99,Fisher-Price Disney Toy Story
RoomMates Mickey And Friends Roadster Racer Removable Wall Mural - 10.5 feet X 6 feet,95.62,Friends Roadster Racer
"Fisher-Price Imaginext DC Super Friends, Shazam! & Tiger",33.0,Shazam! & Tiger
"Cars 3 Motor Speed Ball Pit, 1 Inflatable & 15 Sof-Flex Balls, Red/Yellow, 28""W x 28""D x 33""H",27.99,Inflatable &
Adora Adoption Baby Essentials “It's a Girl” 16 Inch Girl Clothing Toy Gift Set for 3 Year Old Kids and up,38.98,Adora Adoption
Corinth,49.99,
"LEGO Desk Drawer 8, Grey",17.99,LEGO Desk
PlayMonster Automoblox Mini X11 Rivet,9.98,PlayMonster
"Papo Ice Unicorn Figure, Multicolor",15.99,Papo Ice Unicorn Figure
"Creative Balloons Celebrity 9"" Latex Balloons, Decorator Royal Blue, Pack of 144",16.72,Creative
Manhattan Toy Soccer Winkel Rattle and Sensory Teether Baby Toy,9.98,Manhattan Toy
"Redcat Racing Aluminum Rear Lower Suspension Arms (2 Piece), Blue",14.4,Redcat Racing
"Disney The Nightmare Before Christmas Jack Skellington Full Size Poseable Hanging Character Decoration, Multi",27.47,Disney The
Davis Quick Ref Coastwise Piloting #126,8.08,Davis Quick Ref
"REALBUG OP404 Necklace, Shiny Pink",9.59,REALBUG OP404 Necklace
Stephen Joseph Kids' Toddler Cats,25.73,Stephen Joseph
"Trend Lab Dr. Seuss What Pet Should I Get Canvas Growth Chart, Green/Brown/Blue/White",17.13,Green/Brown/Blue/White
Hasbro Gaming Hot Tub High Dive Game With Bubbles For Kids Board Game For Boys and Girls Ages 4 and Up E1919,7.49,Hasbro Gaming
Fenwick Pflueger NightHawk Fly Kit,149.95,Fenwick Pflueger
"Disguise Light Fury Classic How to Train Your Dragon Child Costume, X-Small REMPTY (3T-4T)",16.98,Disguise Light
Barbie Collector Mermaid Enchantress Fantasy Doll with Pink and Blue Hair,49.5,Barbie Collector
Disguise Disney Anna Frozen 2 Girls' Wig,15.99,Disguise Disney
"Disney Mulan Fashion Doll with Skirt Armor, Shoes, Pants, and Top, Inspired by Disney's Mulan Movie, Toy for Kids and Collectors",14.99,Disney
Monogram Online AP-T220-5 Customized Thinking Kids Pillowcase,19.25,Monogram Online
"Duratrax Hatchet MT 3.8"" RC Monster Truck Tires with Foam Inserts, CS Sport Compound, Mounted on 1/2"" Offset Black Wheels (Set of 2)",37.99,CS Sport Compound
Cardinal Industries USA Map Puzzle,5.98,Cardinal
Congratulations Sign Banner Party Accessory (1 count) (1/Pkg),8.92,Congratulations
"Vallejo Acrylic Paint, Tan Yellow",5.17,Vallejo Acrylic Paint
Gloom of Thrones,15.95,Thrones
Melissa & Doug Sunny Patch Seaside Sidekicks Squirters With 4 Squeeze-and-Squirt Animals - Water Toys for Kids,8.92,Melissa & Doug
"Rhode Island Novelty 20"" Dino Bp T-rex , Green",16.03,Rhode Island Novelty
Bachmann Industries Smart Phone Controlled Train Locomotive with L&N #549 HO Scale,125.43,L&N
"Rollerblade Macroblade 84 ABT Men's Adult Fitness Inline Skate, Black and Red, Performance Inline Skates",259.99,Rollerblade
Star Wars: Imperial Assault - Agent Blaise Villan,9.95,Imperial Assault - Agent
Lanterns Dice- Lights in The Sky,30.32,Lanterns Dice-
"DC Super Villain Collection Joker Girl's Costume with Tutu Dress, Medium",29.99,DC Super Villain
Blue Orange Dr. Eureka Speed Logic Game,20.17,Blue Orange Dr.
"WILD! Science Test Tube Chemistry Lab - 50+ Fun Experiments and Reactions for Kids Aged 8+ - Explore STEM - Learn About Solids, Liquids, Gases and More!",27.5,
"Child's Gladiator Costume, Large",21.84,Child's
The Puppet Company Long-Sleeves Unicorn Hand Puppet,19.99,The Puppet
"Rayne Longboards Minotaur 34"" Double Kick Cruiser Skateboard",53.99,Rayne Longboards
"""Chicago Bulls NBA Collection"" Printed Latex Balloons, Party Decoration",4.58,Printed Latex Balloons
"Squeezamals 3Deez, Slow-Rise Foam Stuffed Animals, Panda-Samantha",7.99,Slow-Rise Foam Stuffed Animals
"Crayola Finding Dory Art Kit Art Gift for Kids 5 & Up, 42-Piece Set, Includes: Markers, Crayons, Colored Pencils & Coloring Pages in a Travel-Friendly Case",10.2,Crayola Finding
Gulf Coast Sales NFL Rally Men Hoodie Bear,14.99,Gulf Coast Sales
Asmodee Sun Tzu Board Game,37.58,Asmodee Sun Tzu Board Game
"Bollovi Confetti Balloons With Paper Dot Party Supply (30 Piece), 12"", Gold",8.98,Bollovi Confetti
Thule Cougar/CX2 Child Carrier Rain Cover,57.45,Thule
"DC Comics Poison Ivy Deluxe Costume, Green, Large",78.39,DC Comics
Teamson Kids - Fashion Polka Dot Prints Bella Dress Up Unit - Pink/White,102.99,Teamson Kids -
"Steiff My First Teddy Bear Plush, Pink",32.95,Steiff My First
Buffalo Games - Vivid Collection - Hummingbird Garden - 1000 Piece Jigsaw Puzzle,13.28,Piece Jigsaw Puzzle
"Manhattan Toy Baby Stella Darling Dish Baby Doll Accessories Set for 12"" and 15"" Soft Dolls",11.25,Manhattan Toy
"RPM Revolver Wheels - Traxxas Slash 2WD Front, Nitro Slash, Chrome",10.99,RPM Revolver
"Earth Rugs TS-508CJT-4 Trivet, Green",49.17,Earth Rugs
4M Paint Your Own Mini Tea Set,11.55,
Good Smile Onmyoji: Kagura Nendoroid Action Figure,56.47,Good Smile
Empire Magic Collection #3,10.49,Empire Magic
Osmo Genius Kit with Osmo Coding Jam Game (Add-on) Bundle,164.98,Osmo Genius
"School Specialty Math Blank Spinners, Grades K-6 (Set of 10)",17.09,School Specialty
Sweet Jojo Designs 2-Piece Nature Fox Bear Animals Boys Window Treatment Panels for Outdoor Adventure Panels,54.99,Sweet Jojo
American Greetings Paw Patrol Party Supplies Bundle Pack for 8 guests (42-Count),19.99,American
WizKids Pathfinder Battles Legends of Golarion Booster Brick,94.97,WizKids
FloZ Dragon Grumman X-29 1/144 diecast Plane Model Aircraft,15.18,FloZ Dragon
Funko Pop Disney: Wreck-It Ralph 2 -Fix-It Felix,8.67,Funko Pop
"Clementoni ""Van Gogh - Starry Night Over The Rhone"" Puzzle (1000 Piece)",20.49,
Wonder Woman Cape and Sword Set,21.95,Wonder Woman
"Fortnite 6"" Legendary Series Figure, DJ Yonder",14.99,
"Wildkin 40210 Paisley Olive Kids 12 Inch Backpack, Pack 'n Snack",20.1,Wildkin 40210 Paisley Olive
"Little Tikes Cozy Coupe, Classic Coupe",44.44,Little Tikes
"Brilliant Baby’s 1st Toothbrush Teether - Premium Silicone First Toothbrush for Babies and Toddlers - Kids Love Them, Blue, 1 Count",7.86,Brilliant
MasterPieces NCAA Checkers Board Game,18.15,MasterPieces
RoseArt Jumbo Crayons 8-Count Packaging May Vary (078VA-8),4.85,RoseArt Jumbo Crayons
Miniland Educational - super Pegs Pedagogical Set (32 pieces),28.95,Miniland
"Wild Republic Snakes, Super Jumbo Snake Plush, Giant Stuffed Animal, Plush Toy, Gifts for Kids, Red Scales, 113""",27.52,Plush Toy
"Hedstrom Avengers Assemble Playball Party Pack, Size Large, 8 Balls",32.75,Hedstrom
WOW! Stuff Collection Harry Potter Wingardium Leviosa Kit,15.51,WOW
Kindred Hearts Dolls Paige,29.99,Kindred Hearts
"Losi 43T Spur Gear, Plastic: 8E 2.0 / 3.0, LOSA3560",9.99,Losi 43T Spur
Forum Novelties Mega Strobe Super Bright Party Light with Thunder Sound Effects,30.19,Forum Novelties
"Amscan 396753 Fancy Birthday Brights Crown Tiara Party Accessories, Multicolor, 3 x 4 1/2"", 3 1/2"" 1/2"", gold",8.02,Amscan 396753
Bigjigs Rail Double Suspension Bridge - Other Major Wooden Rail Brands are Compatible,23.73,Bigjigs Rail
"Capsule Chix Ultimix 4 Pack, 4.5 inch Small Doll with Capsule Machine Unboxing and Mix and Match Fashions and Accessories",28.38,Capsule Chix
Bachmann Trains E-Z Mate Magnetic Knuckle Couplers - Center Shank - Long (Card of 12),25.65,Bachmann Trains
Fisher-Price Brilliant Basics Lil Snoopy,6.99,Fisher-Price
Space Base: The Emergence of Shy Pluto,22.37,Space
Playroom Entertainment Día De Los Muertos Deluxe,11.91,Playroom Entertainment Día De
"""Montreal Canadiens Collection"" Luncheon Napkins",6.59,
Scalextric Mclaren F1 GTR - Le Mans 1995 Harrods 1: 32 Slot Race Car C4026,39.99,Scalextric
Elf on the Shelf Boy Light with Gingerbread Costume (Amazon Exclusive),32.86,Gingerbread Costume
"11 Piece Tegu Magnetic Floating Stacker Building Block Set, Big Top",26.64,
Late For the Sky Pittsburgh-opoly,19.95,Late For the Sky
"LAVIEVERT Jigsaw Puzzle Roll Mat Puzzle Storage Saver Black Felt Mat, Long Box Package, No Folded Creases, Jigroll Up to 1,500 Pieces - Comes with A Drawstring Opening Design Bag",15.99,No Folded Creases
Hape Wooden Railway Lucky Ladybug and Friends Train Set,36.61,Ladybug
"Little Tikes Princess Cozy Coupe, Princess Coupe",49.99,Little Tikes
Rollerblade 90mm Wheel Kit,79.99,Rollerblade 90mm
Gate Keeper Games Earth Elemental Halfsies Dice - 7 die polyhedral dice Set - Cerulean Blue & Terran Brown - Silver Numbering,11.95,Gate Keeper
Be Amazing! Toys Universe Unboxed by Scishow: Survival Science Lab,11.99,Be
"Stupell Home Décor Dream Big Typography Canvas Wall Art, 16 x 20, Multi-Color",34.99,Multi-Color
"Fisher-Price Nickelodeon Shimmer & Shine, Teenie Genies, Series 2 Genie (8 Pack), #7",7.5,Fisher-Price
"First Builders Big Building Bag AND Mega Bloks ABC Musical Train Building Set, 50 pieces",37.96,First Builders
"Sloth Party Happy Birthday Napkins, 16 ct",5.35,Sloth Party
Funko Pop! Disney: Aladdin Jafar (Red) Collectible Figure,10.54,Funko
Dart Zone Blitzfire Quickshot Auto-Advance Rotating Cylinder Dart Blaster with 6 Universal Waffle-Tip Darts,13.63,Universal Waffle-Tip Darts
"Ivy Lane Design Not-Aplicable Chalkboard Clips, Mini Circle, 10-Count",10.0,Ivy Lane Design
"Learning Resources STEM Force & Motion Activity Set, 20 Pieces, Ages 5+",17.99,Learning
Lamentations of the Flame Princess Obscene Serpent Religion 2,17.82,
"RPM Slash Front Skid Plate, Blue",11.04,RPM Slash Front
Ginger Ray Prosecco Champagne Bubbly Drinks Wall Holder Wedding Hen Party Decoration -Gold Wedding,20.59,Ginger Ray
WWE Austin Aries Action Figure,10.99,WWE Austin Aries Action Figure
Wildkin Heroes Rolling Luggage,49.99,Wildkin Heroes
Daron F-22 Best Lock Construction Toy (80 Pieces),10.95,Daron
Rubie's Costume Company Rainbow Tie for Pet,4.48,Rubie's Costume
"Creative Motion Monkey Plush Animal, Brown",8.46,Creative Motion
Czech Games Codenames,19.99,Czech Games Codenames
Girl's Wizard of Oz Trunk Set,39.99,Girl's Wizard of
"Melissa & Doug Jewelry Made Easy Semiprecious Stone Bead Bracelet-Making Set (Great Gift for Girls and Boys - Best for 8, 9, 10, 11, 12 Year Olds and Up)",9.71,Melissa & Doug
Privateer Press - Warmachine - Khador Winter Guard Rifle Corps Model Kit,44.39,Rifle Corps
"Jay Franco Harry Potter Always Bed Set, Twin",59.99,Jay Franco Harry
Duncan Toys Butterfly XT Yo Yo with Ball Bearing Axle (Colors may vary),4.99,Duncan Toys
"Wild Republic Iguana Plush, Stuffed Animal, Plush Toy, Kids Gifts, Cuddlekins, 15 Inches",14.94,Plush Toy
Bell Paw Patrol Skye Pad & Glove Set,12.88,Bell Paw Patrol
"Qualatex Foil Balloon 13955 Little Man Bow-tie, 18"", Multicolor",6.01,Qualatex Foil
"Didax Problem Solving Practice Cards, Grade 3",14.91,Didax Problem
Funko Pop! Animation: Rick & Morty - Prison Escape Rick Collectible Figure,10.96,Rick & Morty - Prison
Name Stampers Emily Rubber Stamps,6.99,Name Stampers
"Post-it Pop-up Note Dispenser, Rose Gold, 3 Inches x 3 Inches, 1 Dispenser/Pack (WD-330-RG)",8.99,Post-it Pop-up
Theo Klein Cleaning Trolley,28.79,Theo Klein
"JACKPOT! Castle Low Loft Stairway Bed with Slide Blue & White Tent and Tower, Loft Bed, Twin, Gray",701.74,Slide Blue & White Tent
Star Wars Foil Decor,8.97,Star Wars Foil
Mirrycle Incredibell Original Bicycle Bell,9.22,Mirrycle
"Creative Converting CANDLE-4561 Polka Dot 2 Numeral Candle, 2.875-Inch x 1.5-Inch",4.83,Creative
Sweet Jojo Designs 3-Piece Feather Girls Full/Queen Bedding Childrens Teen Bedding Set,103.04,Sweet Jojo
Redcat Racing 24031 Complete Truck Wheels For Sumo Rc (4Count),10.21,Redcat
"Funko Pop Keychain: Mickey's 90Th - Brave Little Tailor Collectible Figure, Multicolor",6.93,Funko Pop
"Marvel Avengers Endgame Bench with Storage, 30” Toy Chest and Trunk",59.99,Storage
British Pier 275 Piece Jigsaw Puzzle,23.53,Jigsaw Puzzle
Bachmann Industries C&NW Old-Time Box Car (HO Scale Train),25.1,Bachmann Industries C&NW Old
C&D Visionary Pink Floyd Back Catalogue Sticker Childrens Arts & Crafts Adhesives,7.15,Crafts Adhesives
"Mastercraft Collection North American Plane w/ Rolls-Royce Engine P-51D Mustang ""Betty Jane"" Airmen Model Scale:1/24",187.41,Mastercraft
"Lulu Jr. Illustory Book Making Kit, Multicolor",29.16,Lulu Jr.
Pink Stork Girl Baby Shower Cupcake Kit for 24,12.04,Pink Stork Girl
"Vallejo Building Set Model Air Paint, 17ml (Pack of 16)",43.28,Vallejo Building
"Nuby Silly Hummingbird & Flower Interactive Suction Toys with Built-in Rattle, 2Piece, Pink",12.99,Nuby Silly
"Colorations CPTMA Powder Tempera, Magenta - 1 lb.",10.33,Colorations
Hot Wheels 9-Car Gift Pack (Styles May Vary) AND Hot Wheels Spin Storm Track Set [Amazon Exclusive],54.28,Amazon
Mega Construx Pokémon Psyduck,9.1,Mega Construx
"Pillow Pets Disney Pixar Cars 3, Jackson Storm, 16"" Stuffed Plush Toy",19.36,Pillow Pets
"Krumbs Kitchen Chef's Collection Silicone Turner, Green",7.5,Krumbs Kitchen
"USAOPOLY PZ104-522 Game of Thrones Premium Jigsaw Puzzle, Multicolor",14.99,USAOPOLY
"Vallejo Insignia Blue Paint, 17ml",5.99,Vallejo Insignia Blue Paint
Cathedral Art 50th Anniversary Frame,22.99,Cathedral
"Handy Art Little Masters Tempera Paint Gallon, Magenta",17.38,Handy Art Little
"Wild Republic Harp Seal Plush, Stuffed Animal, Plush Toy, Gifts for Kids, Hug’Ems 7",9.99,Plush Toy
Bigjigs Rail BJT442 Car Carriage,9.99,Bigjigs Rail
"Chenille Kraft 4357 Wonderfoam Magnetic Alphabet Letters, Assorted Colors. 110/Pack (CKC4357)",10.84,Chenille
"ToySource Venom the Snake Plush Collectible Toy Lizard Dinosaur Toy, Random, 13""",25.54,ToySource
Star Wars Force Link Rathtar & Bala-TIK Figure,10.53,Star Wars Force
The Learning Journey: Lift & Learn Clock Puzzle - Pictures Underneath Each Piece - Alphabet and Phonics Learning Toy,10.83,Phonics Learning Toy
Blade Chroma BLH8631 Camera Slide Mount,7.99,Blade Chroma
"Delta Children Lil' Drive Baby Activity Walker, Black",46.49,Delta Children
9-Pocket Pokemon Full-View Pro Binder: Silhouettes Album,24.99,
Rubie's Costume Co - Adult Reindeer Jumper,39.99,Rubie's Costume
"Hey! Play! Kids Science Kit-Lab Set to Create Solutions, Litmus Paper, & More-Great Fun & Educational Stem Learning Activity for Boys & Girls",8.99,Create Solutions
Bestway Lil Champ Play Center Inflatable Play Center,47.22,Bestway Lil
Rubie's Costume Company Houndstooth Tie for Pet,6.24,Rubie's Costume
Buffalo Games - Adorable Animals - Picnic Raiders - 300 Large Piece Jigsaw Puzzle,7.99,Buffalo Games -
"Melissa & Doug Sunny Patch Spark Shark Toss and Catch Net Pool Game With 2 Balls, Great Gift for Girls and Boys - Best for 6, 7, and 8 Year Olds",12.99,Melissa & Doug Sunny Patch
Star Wars Episode VIII - The Last Jedi Super Deluxe Girl's Rey Costume,27.99,Star Wars
"Pillow Pets Disney, Rolly, 16"" Stuffed Animal Plush Pillow Pet",23.99,Pillow Pets Disney
"Llorens 15"" Soft Body Baby Doll Evelyn",59.99,
Guillow's Grumman F6F-3 Hellcat Model Kit,73.24,Guillow
"Knaack 2032 Classic 32"" x 19"" x 18-1/4"" Storage Chest",352.58,Knaack 2032
"Rubie's DC Super Villain Collection Harley Quinn Girl's Costume with Tutu Dress, Medium",19.99,Rubie's DC Super
Maxim Enterprise INC Double Door Engine Shed,19.99,Door Engine Shed
Punisher Skateboards Elephantasm Complete 31-Inch Skateboard All Maple,39.99,Punisher
Franklin Sports Rod Hockey Pro,46.7,Franklin Sports
"Vallejo Acrylic Paint, Grey",6.96,Vallejo Acrylic Paint
"Jada Venia 9.75""x7.75"" Love is Patient Light Box Insert",11.72,Jada
"Dream Wall Decal, Creeper Nest",8.79,Dream Wall
"MasterPieces Xplorer Maps Jigsaw Puzzle, Great Smoky Mountains, National Park, 100% Made in USA, 1000 Pieces",17.98,MasterPieces
"Itzy Ritzy Silicone Teething Necklace Made of BPA-Free Food Grade Silicone Petite Strand, Primrose",14.99,Primrose
"Canal Toys So Glow DIY Magic Jar Kit-Combo Glitter Water (25Piece), Multicolor",15.51,Canal Toys So
"Wilton 2105-4619 Despicable Me Minions Cake Pan, Metallic",12.22,Wilton 2105-4619
Rubie's Costume Co Pirate Hand Hook Costume,6.22,Rubie's Costume
Corgi NASA Apollo 11 50th Anniversary Columbia Moon Landing Command Module Die Cast Metal Space Model CS90647,28.8,Corgi
"Calico Critters, Doll House Furniture and Décor, Bed & Comforter Set",8.39,Calico
"Amscan 115920.05 Latex Balloons, 5"", Orange",6.67,Latex Balloons
"Swing Set Stuff Inc. Rotomold Tire with SSS Logo Sticker Playground Attachment, Blue",92.99,Swing Set Stuff
Funko Pop! Animation: We Bare Bears - Grizz,6.81,Funko
"Edupress Splat Game, Addition (EP63759)",12.99,Edupress Splat
Application Hang Loose Patch,8.28,Application Hang
"Poler Unisex-Adult's Classic Rucksack-ptt, PINE TREETOP, One Size",61.84,Poler Unisex-Adult's
"MasterPieces Hershey's Shaped Collection Jigsaw Puzzle, Reese's, 500 Pieces",14.99,MasterPieces
Squeeze With Love Animal Adventure Stud Muffins | Pink Bear,29.99,Squeeze With
"Triple Eight Sweatsaver Liner Skateboarding Helmet, All Black Rubber, X-Large",44.99,Triple Eight
PROLINE 1012414 Bf Goodrich All-Terrain Ko2 1.9 G8 Compound Rock Terrain Tires,21.99,PROLINE 1012414
Roylco Inc. R-2113 Tropical Colored Noodles Art-a-roni,12.41,Roylco Inc.
Klutz Coloring Crush,12.54,Klutz Coloring Crush
Melissa & Doug Sunny Patch Bella Butterfly Big Bubble Wand,6.99,Melissa & Doug Sunny
Yu-Gi-Oh! Duel Overload Box,41.45,
"Dimensional Pop-Out Style Centerpiece, Happy New Year Fireworks",9.89,Dimensional
Rubie's Novelty Hand Bell,14.95,Rubie's Novelty
Melissa & Doug Personalized Fire Chief Role Play Costume Dress-Up Set Costume,30.29,Melissa & Doug
HBO Game of Thrones: Westeros Intrigue,9.75,HBO Game of
"Tudor Games 4-04-D NFL Home Jersey - Denver Broncos Dark Pants Painted 11 Electric Football Players, Multicolor (Pack of 11)",14.65,Tudor
"Forum Novelties Zombie Girl Costume, Child's Medium",27.07,Forum Novelties
Creative Cedar Designs Playset Telescope Accessory,15.99,Creative Cedar
Rhode Island Novelty 21 Inch Rainbow Magic Ball Star Wand,16.99,Rhode Island
"Perler Beads Fuse Beads for Crafts, 1000pcs, Orange",4.99,Crafts
Crocodile Creek - Secret Garden - 500Piece Jigsaw Puzzle for Ages 5 & Up,9.98,Crocodile
"Guidecraft Jumbo Texture Dominoes Set - Multi-Color/Texture Sort and Matching Game for Toddlers, Kids' Memory and Sensory Skills Development Toy",33.56,Guidecraft Jumbo
Estes Wizard Rocket (Pack of 3),26.99,Estes Wizard
"Baby Aspen Narwhal Porcelain Piggy Bank, Green, One Size",28.89,Baby Aspen
"Disney 22"" Minnie Mouse Holiday 2019 Plush, Multicolor",19.99,Disney
"Amscan Party Decorations, The Party Continues - 50 Decorating Kit, Party Supplies, Multicolor, Multisize, 9ct",9.99,Amscan Party Decorations
Dragon Boat,12.99,Dragon
"Crayola Metallic Permanent Markers, Fine Point, Assorted Colors, Art Supplies, 6 Count",9.99,Crayola Metallic
Ravensburger Disney Incredibles 2 - 100 Piece Puzzle,12.65,Piece Puzzle
DC Collectibles Batman The Animated Series: Mr. Freeze Action Figure,29.4,DC Collectibles Batman
MasterPieces Collegiate Wisconsin Badgers 1000 Piece Stadium Panoramic Jigsaw Puzzle,14.93,MasterPieces
PlayGo Roll'N Chime Walk & Push Along Toy For Baby Toddler Walker Toy - Learning and Pretend Play Set,14.98,PlayGo Roll'N
"GUND Sparkle Snacks Jumbo Burger Plush, 6""",18.97,GUND Sparkle
"Papo The Ice Field Playset, Multicolor",28.78,Papo The Ice
"Caspari Entertaining Double Deck of Bridge Playing Cards, Jumbo Type, Dogs & Cats",9.97,Caspari
Monopoly: Fortnite Edition Board Game Inspired by Fortnite Video Game Ages 13 & Up,15.88,
PlayGo Baby Rock Star Guitar,14.99,Baby Rock Star Guitar
Forum Reversible Phantom Costume Cape 56-Inches,17.25,Forum Reversible
"Huffy Kids Inline Scooter, Star Wars",39.51,Huffy Kids
Badger Basket Heirloom Style Doll Cradle with Blanket & Pillow (fits American Girl Dolls),43.99,Blanket & Pillow
"""Los Angeles Dodgers Major League Baseball Collection"" Plastic Party Cups",14.0,Los Angeles Dodgers
Toysmith Beetle & Bee Make A Spin Big Pinwheel,14.95,Toysmith
"Disguise My First Disney Red Minnie Costume, Black/Red/White, 6-12 Months",19.99,Black/Red/White
"HEALTH EDCO W43150 Prenatal Care Flip Chart, 12"" Length x 17"" Height",91.0,HEALTH EDCO
Kotobukiya Girls Und Panzer Der Film Anchovy Swimsuit Ver. ANI Statue PP698 Action Figure,61.13,Kotobukiya Girls
"Anagram International Letter L Quad Package Balloon, 18"", NA",2.63,NA
"SugarSugar Wrap It Up Costume, Small",13.34,SugarSugar Wrap It Up Costume
Learning Advantage 8651 Unknown Quantities Addition and Subtraction Flash Cards,18.49,Learning
"Sunstaches Pacman Pink Ghost Sunglasses, Party Favors, UV400",16.83,Party Favors
Wario Child Hat,12.99,Wario Child
RoomMates Sofia The First Peel And Stick Wall Decals,10.0,RoomMates Sofia
C&D Visionary S-8078-M Stickers-Self Adhesive Action Figure,3.99,C&D Visionary
"Disney's Mulan, ""Tradition"" Woven Tapestry Throw Blanket, 48"" x 60"", Multi Color",25.95,Disney
Circuit Cubes Bright Lights STEM Toy Lego Compatible Electronic Building Blocks Construction Kit Ultra Bright LED Projects,19.1,Circuit Cubes
"lunch bag Bag001 Reusable Zip Closure Handbag, Back Pocket Insulated Cooler Ouo Lunch Box Tote Bag, 5.5L, Navy Blue and Gray",12.99,Navy Blue
Rhode Island Novelty ~ 12 ~ Foam Dice ~ 1.5 Inch ~ Games Math Teaching ~ New,4.19,Rhode Island
"Gold Medal Bean Bags -10Bean Bag Chair Size: Extra Large, Color: Navy Blue",73.0,Gold Medal Bean
ALEX Toys Artist Studio Ready Set Art Table,94.99,ALEX Toys Artist
"Looney Tunes Bugs Bunny Girls Hooded Costume, Child's Large",25.83,Looney Tunes
Super Wings – Advent Calendar | Countdown Calendar with Exclusive Characters & Accessories | 24 Gifts Included,15.99,Super Wings
LeapFrog My Own Leaptop (Frustration Free Packaging),21.95,LeapFrog My Own
Doc McStuffins Baby All in One Nursery Toy,24.99,Doc McStuffins
"Bachmann Trains EMD GP40 Dcc Ready Diesel Locomotive CSX #4409 (Dark Future) - HO Scale, Prototypical Blue",76.22,CSX
"Fred PICK YOUR NOSE Animal Nose Paper Cups, 24-Pack",8.27,Fred PICK YOUR
"Bachmann Industries Allegheny Refining ACF 10,000 gallon Single-Dome Tank Car (N Scale), 36'-6""",20.73,Single-Dome Tank Car
FOCO NHL Unisex Thematic Soda Can Bank,16.4,FOCO NHL Unisex
"Driveway Games LADRTS-GM-00140 Ladder Ball Toss Game with 6 Bolos Bolas & Carrying Case for Outdoor, Lawn, Yd",29.04,Driveway Games
"Sprogs Vinyl Soft Seating Curved Stool, 18"" H, Blue, SPG-1012BL-A",169.9,Sprogs Vinyl
"Dolce Baby Aardvark Interactive Stuffed Animal Plush Toy 9"", Educational vibrating sensory holiday gift for kids",9.59,Dolce Baby
"Bachmann Industries Smooth Side B&O N-Scale Baggage Car, 72'",31.3,Bachmann
"Steiff Ping Panda - 34""",175.4,Steiff Ping
Breyer Traditional Halter with Lead Horse Toy Accessory,11.08,Breyer
Preiser 10431 Recreation & Sports Sunbathers on Folding Chairs HO Scale Figure,9.45,Preiser 10431
"Funko Pop! Keychains: Harry Potter - Ron (Yule Ball), Multicolor",5.99,Funko
Chara-ani My Hero Academia: Izuku Midoriya 1: 8 Scale PVC Figure,89.99,Chara-ani My
KODAK PREMIUM PUZZLES Colorful Kayaks Jigsaw Puzzle,9.99,KODAK PREMIUM
Breyer Classics Customizing - Thoroughbred Horse Craft Activity Set,19.99,Breyer Classics
Hobby Boss TBF-1C Avenger Airplane Model Building Kit,52.33,Hobby Boss
"Gila PFW486 Privacy Frosted Film-48 x6.5' Window Film, 48"" x 6.5', White",9.99,Gila PFW486
"Lionel Electric O Gauge Model Train Accessories, Plug-Expand-Play Art Operating Billboard",54.99,Lionel Electric
Hot Wheels id Night Shifter {Nightburnerz},6.47,Hot Wheels id
"Funko Pop! Horror: Pan's Labyrinth - Pale Man Collectible Figure, Multicolor",8.78,Pan
Crazy Bonez Skeleton Spider,9.99,Crazy Bonez
"Melissa & Doug Natural Play Giant Floor Puzzle: Under The Sea (35 Pieces, Great Gift for Girls and Boys - Best for 3, 4, 5, 6, and 7 Year Olds)",12.74,Melissa & Doug
Case-Soap - 1 - each (Assorted Colors),6.99,
Areaware Minim Playing Cards,10.45,Areaware Minim Playing Cards
"Etch A Sketch Freestyle, 2-in-1 Drawing and Tracing Pad with Magic Pen Stylus",19.99,Etch A Sketch
"Fast & Furious Brian's Mitsubishi Lancer Evolution VII DIE-CAST Car, 1: 24 Scale Lime Green",20.58,Fast & Furious Brian's
"Delta Education My Math Notebooks, Grades 3-6 (Pack of 10)",19.95,Delta Education
SwimWays Standard Swim Pool Noodle Set Pack of 35 - Multicolor,64.99,SwimWays
Samurai Deluxe Costume for Kids,69.99,Samurai Deluxe
"TOMY John Deere Sit-N-Scoot Tractor Toy, Green, One Size",27.69,TOMY John Deere
Pro-line Racing 341000 Rat Rod Clear Body for Revo 3.3 Summit and E-Revo Radio Control Body,30.36,E-Revo Radio Control Body
Lightseeker Flight Pack Grimglider,9.38,Lightseeker
"5.5"" LIZARDS",6.55,
Rubie's Costume Complete Clown Makeup Kit,7.92,Rubie's Costume
Medicom Peanuts: Statue of Liberty Snoopy Ultra Detail Figure,12.28,Medicom
"Anico Plush Teddy Bear, Stuffed Animal, Bright Orange, 8 Inches Tall",10.78,Bright Orange
"Cotton Tale Designs Baby's 1st Chair, Heaven Sent Girl",71.54,Cotton Tale
Melissa & Doug Bella Butterfly Bubble 4 Pack Novelty,11.43,Melissa & Doug
Big Hero 6 The Series Squish-to-Fit Baymax with Accessories,19.99,Big Hero 6 The
Disney Frozen Pink Table Lamp,20.95,Disney Frozen
Little Live Pets - My Kissing Puppy - Wrinkles,37.27,Little Live
Christian Lacroix Maison De Jeu 250 Piece 2 Sided Puzzle,19.88,Christian
"Mudpuppy Forest Night and Day Magnetic Puzzles – Ages 4-7 – Includes 2, 20-Piece Magnetic Puzzles and a Magnetized Tri-Fold Portfolio – Great for Travel, Quiet Time",12.59,Mudpuppy Forest Night
"Melissa & Doug Created by Me! Paint & Decorate Your Own Resin Bank Craft Kit for Kids 2 Pack - Owl & Piggy Banks, Multicolor",10.27,Melissa & Doug Created
LEGO Marvel Super Heroes Avengers: Infinity War The Hulkbuster: Ultron Edition 76105 Building Kit (1363 Pieces),112.9,LEGO Marvel Super Heroes
Team Redcat 505215 Rear Wing Support,19.47,Team Redcat
Buffalo Games - Art of Play Collection - Tiger Moon - 500 Piece Jigsaw Puzzle,10.99,Buffalo Games -
