asin_name,asin_value_usd,brand
"Rubie's Child's Monster High Clawdeen Wolf Costume, Small",21.0,Rubie's Child's
Enchantimals Lorna Lamb Doll,8.13,Enchantimals
KIDS PREFERRED Emoji Small Rainbow Poop Plush,8.31,KIDS PREFERRED
"Forum Novelties Arabian Prince Costume, Small",16.99,Forum Novelties
BanBao Farm City Building Kit (541 Piece),48.43,BanBao Farm City
"Hoohobbers Gofer Table, Red",65.0,Hoohobbers Gofer
"Steiff Starly Dangling Unicorn Plush, White",62.37,Steiff Starly
"Barbie Dreamtopia Merman Doll, Blonde Hair",4.54,Barbie
"Amscan 170333 Happy Birthday Letter Candles, 2 1/8"", Multicolor",6.13,Amscan 170333
Spalding NBA Varsity Outdoor Basketball,9.97,Spalding NBA
"MightySkins Skin Compatible With DJI Spark Drone & Controller - Aztec Pyramids | Protective, Durable, and Unique Vinyl Decal wrap cover | Easy To Apply, Remove, and Change Styles | Made in the USA",19.99,"Protective, Durable"
Eurographics Forest Stream 1000-Piece Puzzle,18.55,Eurographics Forest Stream
"Young Heroes Child's Fire Fighter Costume, Medium",21.94,Young Heroes
"First & Main 10"" Grizzles Teddy Bear, Multicolor",16.29,First & Main
"Rubie's Women's Marvel Universe Adult Rescue Sequined Corset, Multi, Medium",9.19,Rubie's Women's
"Manhattan Toy Baby Stella Boy Soft First Baby Doll for Ages 1 Year and Up, 15""",23.09,Manhattan Toy
Colored Wooden Block Set,29.99,Colored Wooden
"Fantasy Fields - Magic Garden Thematic Kids Wooden Outdoor Table and 2 Chairs Set | Imagination Inspiring Hand Crafted & Hand Painted Details | Non-Toxic, Lead Free Water-based Paint",130.19,Non-Toxic
Bachmann Industries Boston & Maine 1950's/60's Truck Cab Want Two Piggy Back Trailers (HO Scale Train),46.03,Bachmann
"Eureka Educational Cat in The Hat Sticker Book for Classroom Decoration, 1pc",8.84,Eureka
"JC Toys, La Newborn All Vinyl Anatomically Correct Real Boy 15"" Baby Doll in Striped Long Sleeved Pajama Outfit - for Children 2 Years & Older Designed by Berenguer Boutique - Made in Spain",41.71,JC
"Rubie's Star Wars Rebels Sith Inquisitor Costume, Child Large",18.27,Rubie's Star
Atom Kicktail Longboard,89.49,Atom Kicktail
"Comfort Spaces Pierre 4 Piece Comforter Set All Season Ultra Soft Hypoallergenic Microfiber Pipeline Stripe Boys Dormitory Bedding, Full/Queen, Black Red",49.99,Comfort Spaces
"In the Breeze Green Diamond Kite, 30-Inch",12.72,In the Breeze
"Learning Resources Pattern Blocks Smart Pack, Developmental Toy, Shapes, Patterns, 50 Pieces",11.45,Learning
"Stupell Home Décor Be Happy Typography Canvas Wall Art, 16 x 20, Multi-Color",27.0,Multi-Color
amscan Summer Splash Party Luncheon Napkins | 12 Ct.,14.99,
"Racers Edge 1618 Charge Adapter: Male XT90 to Male 4mm Bullets, 300mm Wire",7.52,Bullets
Trends International Jake Paul Jump - ROOMSCAPES Poster Decal - 18'' X 24'',12.99,Trends
"The Kids Room by Stupell Good Vibes Only Red Green Vibrant Word Design Wall Plaque, 12x12, Multi-Color",29.99,Multi-Color
Little Pink Ladybug Brilliant Bowmaker Classic Kit,19.47,Little Pink
"Rubie's Costume Forest Queen Deluxe Child Costume, Large",10.61,Rubie's Costume
Junior Learning Touchtronic Placeholder Toy,15.38,Junior Learning
PUMA Evercat The All Star Carrysack,17.23,PUMA Evercat The
Flame Toys Kuro Kara Kuri #05 Optimus Prime Transformers,449.99,Flame Toys Kuro
"Way Basics Eco Stackable Connect Storage Cube with Shelf Cubby Organizer, Espresso Wood Grain (Tool-Free Assembly and Uniquely Crafted from Sustainable Non Toxic zBoard Paperboard)",24.99,Espresso Wood Grain
Rubie's Costume Face Painting Sticks,7.98,Rubie's Costume
"Creative Converting Birthday Girl Pick Letters Candle Set, Pink",5.53,Creative
Loopeez Silent Fidget Toy 3 Pack TPG-86103,7.99,Loopeez Silent
Great Eastern Entertainment Your Lie in April Kousei Button,7.02,Great Eastern
Busch 43644 Garden Center HO Scale Model,22.14,Busch 43644
Breyer Classics Little Prince: Book and Horse Toy Set (1:12 Scale),21.32,Breyer Classics
JunFac 90028 Hardened Universal Shaft for Axial Honcho,35.56,JunFac 90028
"St. Patrick's Day, Plastic Googly Stickers, 5.9"" x 6.3""",4.92,St. Patrick's
"Rubie's 887553 Secret Wishes DC Comics Justice League Superhero Style Adult Corset Top with Logo Sequined Batgirl, Small, Black/Multicolor",35.04,Rubie's 887553
Disney Princess Heart Strong Snow White Dress,16.34,Disney Princess
"Bright Starts Teethe & Read Toy, Style May Vary",4.99,Bright Starts
Hauck Lightning - Pedal Go Kart | Pedal Car | Ride On Toys for Boys & Girls with Ergonomic Adjustable Seat & Sharp Handling - Pink,121.12,Hauck
DJECO Butterfly Twirl Paper Mobile Room Decoration,25.99,DJECO Butterfly
Edge home Products Jungle Walltoons Wall Sticker,6.96,Edge home
Bif Bang Pow! Star Trek The Original Series Captain James T. Kirk Pin Mate Wooden Figure,3.88,Bif Bang
"MightySkins Skin Compatible with DJI Mavic – Art | Protective, Durable, and Unique Vinyl Decal wrap Cover | Easy to Apply, Remove, and Change Styles | Made in The USA",24.99,MightySkins Skin Compatible
Steiff Hummi Humboldt Penguin,30.55,Steiff Hummi
K2 Skate Alexis 80 Boa Inline Skate,120.0,K2 Skate
Cryptozoic Batman '66 Classic TV Series: '66 Batmobile Statue,74.95,Cryptozoic Batman '
DC Collectibles Batman: Arkham Knight: Man-Bat Action Figure,39.99,DC Collectibles Batman
"RPM Heavy Duty Rod Ends (12), White",6.79,RPM Heavy Duty
"MightySkins Skin Compatible with Swagtron T5 - Rainbow Chevron | Protective, Durable, and Unique Vinyl Decal wrap Cover | Easy to Apply, Remove, and Change Styles | Made in The USA",16.99,MightySkins Skin Compatible
The Kids Room by Stupell I Love You a Bushel and a Peck with Monkey Square Wall Plaque,12.97,The Kids Room by
"Skin Compatible with Razor A5 Prime Scooter - Cool Corgi | MightySkins Protective, Durable, and Unique Vinyl Decal wrap Cover | Easy to Apply, Remove, and Change Styles | Made in The USA",24.99,Unique Vinyl Decal
"Bachmann Industries Log Skidder with Crate on 20' Log Car - Large ""G"" Rolling Stock (1:20 Scale)",100.66,Crate
K2 Skate Marlee Boa Inline Skate,65.76,K2 Skate Marlee
WizKids Tower of London Board Game,9.49,London Board Game
K2 Skate Raider Splash Inline Skate,89.95,K2 Skate Raider
Creative Converting Classic Red Fractal 9' Pennant Banner,2.86,Creative
"Forum Novelties I'm Invisible Costume Stretch Body Suit, Leopard Print, Child Medium",23.06,Forum Novelties
Rawlings Sporting Goods Highlighter Series Softball Helmet,34.2,Rawlings
REALBUG Resin Coaster with Amethyst,11.81,REALBUG Resin
OrbSlimy Sweetsations (500G),9.99,OrbSlimy Sweetsations
Club Petz Popomax,25.58,Club Petz
Giant Soft Flexible Latex Rubber T-Rex Dinosaur Posable Toy Realistic Detail Color and Texture 38''L,24.98,Texture 38''L
"Looking Glass Murray the Moray Eel Miniature Glass Collectible, Pack of 48",113.26,Looking Glass
"Ambi Toys, Activity Case",18.3,Ambi
"CGSignLab |""We Accept Credit -Ghost Aged Brick"" Window Cling | 24""x24""",56.99,"CGSignLab |""We"
Star Wars BB-8 Window Decal,9.94,Star Wars BB-8
Great Eastern My Hero Academia GE-52278 Izuku Midoriya Uniform Plush Stuffed Plush,17.23,Great Eastern My
"American Plastic Toys Kids Gigantic Pick-Up Truck, Blue",24.99,American Plastic
"Dimple Washable Coloring Play Mat with Jurassic Dinosaur Era Design and 12 Washable Markers, Small",9.99,Dimple Washable
"Disguise 83982L Witch Toddler Tutu Costume, Large (4-6x)",24.93,Disguise 83982L
"""NFL Drive Collection"" 10.5"" Round, Party Plates",7.0,
Playcraft Santa Fe 12' Pro-Style Shuffleboard Table,59.99,Playcraft Santa Fe
Jonti-Craft 2641JC Unit Blocks Set - Intermediate,109.99,Jonti-Craft
Forum Novelties Men's Deluxe Latex Frog Mask,13.99,Forum Novelties
Deck Box: Dragon Shield Deck Shell: Limited Edition Baby Blue Bethia,13.99,Deck
Corolle Mon Premier Poupon Mini Bath Yellow Toy Baby Doll,18.3,Corolle Mon
PLAYMOBIL How to Train Your Dragon Gobber The Belch with Sheep Sling,39.99,PLAYMOBIL How to
"Viking Toys 1975 Cute Rider Kids Ride On Toy, Bunny, Pink/White",60.0,Viking Toys 1975
"Glitter Girls by Battat - Sweet Tooth Outfit -14"" Doll Clothes - Toys, Clothes & Accessories For Girls 3-Year-Old & Up",9.95,Glitter Girls by
"Mi-Zone Carly Twin/Twin XL Girls Quilt Bedding Set - Teal, Purple, Doodled Circles Polka Dots – 3 Piece Teen Girl Bedding Quilt Coverlets – Ultra Soft Microfiber Bed Quilts Quilted Coverlet",47.26,Mi-Zone Carly
"Jay Franco Astonish Plush Throw, Medium Blanket, Spiderman Ultimate",20.72,Jay Franco
"Bachmann Industries Wood Side Reefer Grand Union Freight Car, 40'",24.45,Bachmann
"Yo Yo Toy YoYo Professional, YoYo string, Grab Passport Tee",19.99,Yo Yo Toy YoYo
PLAYMOBIL Pirate Raft,14.99,PLAYMOBIL Pirate
S.T.E.A.M. Line Toys UGears Mechanical Models 3-D Wooden Puzzle - Mechanical Pneumatic Engine,19.89,S.T.E.A.M. Line
"Melissa & Doug Stained Glass Made Easy Activity Kit, Race Cars (Arts and Crafts, Develops Problem Solving Skills, 80+ Stickers)",9.68,Crafts
Everlast Hand Wraps,6.73,Everlast Hand Wraps
"RhinoMaster Play NT6031 Fish Kickboard, Yellow, Orange, 34"" L x 29"" W x 13.5"" H",12.19,RhinoMaster Play
"Iconic Home Ithaca Nightstand Side Table with Self Closing Drawer Lacquer X Base Brass Finished Stainless Steel, Modern Contemporary, Beige",184.77,Modern Contemporary
Razor Power Rider 360 Electric Tricycle,148.0,Razor Power
"M-Wave L205 Alloy Folding Scooter, 200mm",79.99,M-Wave L205
Craft-tastic – Make A Fox Friend – Craft Kit Makes 1 Easy-to-Sew Stuffie with Clothes & Accessories,19.98,Clothes & Accessories
"Elmer's Classic Glitter Glue, 6 Ounces, Assorted Primary Colors, Set of 3 - E317",3.44,Elmer
"MightySkins Skin Compatible with Razor Turbo Jetts Electric Heel Wheels - Teal Designer | Protective, Durable, and Unique Vinyl wrap Cover | Easy to Apply, Remove, and Change Styles | Made in The USA",19.99,MightySkins Skin Compatible
Privateer Press - Hordes - Circle Orboros: Morvahna The Autumnblade Model Kit,11.99,Privateer
Noch 15721 Black-White Cows 7/ H0 Scale Figures,5.41,Noch 15721
Looking Glass Miniature Collectible - Robin / Blue Jay / Cardinal / Oriole (4-Pack),12.99,Looking Glass
Trends International Teenage Mutant Ninja Turtles Craft Sticker Flip Pack,6.99,Trends
Design with Vinyl Moti 2540 1 Decal Wall Sticker : Music is Love in Search of A Word Bedroom Quote Kids Teen Boy Girl Color: Black Size 12 Inches x 18 Inches,17.94,Design with
Happy Face 37 Keys Electric Organ Children's Kid's Battery Operated Toy Piano Keyboard Instrument w/ Microphone (Pink),23.58,Keys Electric Organ Children's
Panini - 2015-2016 NBA Sticker Collection - Album,11.97,
"3D Christmas Mini Tinsel Wreath with Bow, 12 Ct",35.68,
"ETA hand2mind, AIMS Curriculum: Intermediate Math and Science Kit, (938)",23.11,ETA
"Benjara Wooden Table with Reversible Game Tray, Black",55.3,Benjara Wooden
"Hydor H2Show Lost Civilization - Left Aztec Pyramid Decoration, 12"" x 7"" x 2.8""",22.31,Hydor H2Show
"MightySkins Skin Compatible with DJI Mavic Pro Battery - Black Camo | Protective, Durable, and Unique Vinyl Decal wrap Cover | Easy to Apply, Remove, and Change Styles | Made in The USA",8.99,MightySkins Skin Compatible
"amscan Thanksgiving Autumn Gold Paper Dinner Plates, 10 Ct. | Party Tableware",9.07,Party
Building Block Mini-Figurines Set - Farm (Set of 3),6.46,Building Block
Oktoberfest Centerpiece Party Accessory (1 count) (1/Pkg),6.57,Oktoberfest
"Flagship Carpets CE250-16W Blue Dare to Dream Rug, Motivate Children to Set Goals and Aspire to Meet Them, Children's Classroom Educational Carpet, Kids School, 3' x 5'",35.99,"Meet Them, Children's"
NewRay 57843B Polaris RZR XP 4 Turbo EPS Matte White Lightning Diecast Car,18.51,NewRay
Faller 272912 4 Barrels and 4 tubs N Scale Scenery and Accessories,5.09,Faller 272912 4
"Marvel Captain Official Deluxe Sketch Book, Multicolor",4.99,Marvel Captain
"Amscam 8 Count Reveal Party Girl Or Boy? Invitations, 6 1/4"" x 4 1/4"", Blue/Pink",14.99,Blue/Pink
Hape Beleduc Yellow Duck Kid's Hand Glove Puppet,16.0,Hape Beleduc
Rubie's Star Wars A New Hope Deluxe Luke Skywalker Costume,19.99,Rubie's Star
"Rubies Rosebud Angel Child Costume, Small, One Color",27.4,Rubies Rosebud
"Feber 800011400 Play and Fold Activity House 3 in 1 – Playset - Easy to Store – Indoor and Outdoor, Multicolor",148.91,Feber 800011400
Forum Novelties Men's 56-Inch Long Red Fading Costume Cape,27.99,Forum Novelties
Princess Paradise Baby Edward The Owl Deluxe Costume,29.74,Princess
"Chenille Kraft AC8112-02DI Non-Toxic Pom Pon, Assorted Size, Assorted Hot Color (Pack of 100)",10.36,Kraft
"HandiThings DP Dolphin Playground Toy, Red, Blue, Yellow, One Size",18.94,HandiThings
"Halloween Sensations Child's Black Jack The Pirate Costume, Medium",11.4,Halloween
Watchover Voodoo Mascot for Life Novelty,8.07,Watchover Voodoo
Nautica Diagonal Front Zip Full Size Backpack for Kids,20.11,Nautica Diagonal
My Little Pony Design-A-Pony Princess Luna Figure,8.99,My Little Pony
"Greenington GSK001CA Skol 26"" Counter Height Stool, Caramelized, (Set of 2), Brown",509.58,Greenington
Janod Zigolos Pull Along Fox Early Learning and Motor Skills Toy with Wobbly Non-Skid Wheels and Bell Made of FSC Certified Beech and Cherry Wood for Ages 12 Months+,14.99,Janod Zigolos
Beistle CN019 Grad Caps and Stars Confetti,5.94,Beistle CN019
"Mardi Gras Extra Tall 24"" Stove Pipe Party Hat",9.9,Mardi Gras Extra
Seasons Spooky Cemetery Kit,31.62,Seasons Spooky
Privateer Press Hordes - Legion - Blighted Ogrun Warmongers Model Kit,57.42,Hordes - Legion - Blighted
"FDP SoftScape Play Corner Climb and Slide Set for Toddlers and Kids, Colorful Soft Play Structure for Active Playtime (6-Piece Set) - Assorted",608.24,FDP SoftScape
Transformers Studio Series Voyager Optimus Prime,26.86,Transformers
"Dynamite WP 60A Brushed Marine ESC, DYNM2210",39.58,Dynamite WP 60A
"Linzy Toys 12.5"" Hear No Evil, Speak No Evil, See No Evil Soft Plush Monkey Stuffed Animal for Boys or Girls (Speak No Evil, Boy)",21.98,Linzy
K2 Skate Girls Marlee Inline Skate,57.16,K2 Skate Girls
Forum Women's Flirting with The 50's Deluxe Crinoline,26.75,Forum Women's
"Guardian Kids Bikes Original. 16/20/24 Inch, Multiple Colors for Boys/Girls. Safer Brake System for Kids. Lightweight Aluminum Construction. Easy Assembly. ASO SharkTank.",379.0,Guardian Kids Bikes Original
Prima Marketing Metal Dies for JN Stamp Audrey,15.28,Prima Marketing Metal Dies
"Vallejo Panzer Aces No #4 Paint Set, 17ml",38.79,Vallejo Panzer Aces
Kadokawa The Familiar of Zero: Louise (Final Wedding Dress Version) 1: 7 Scale PVC Figure,279.99,Kadokawa The
Ideal Win Big! Poker Case - 300 Piece Set,25.99,Ideal Win Big
"Kinetic Sand Beach Sand Kingdom Playset with 3lbs of Beach Sand, for Ages 3 and Up",17.99,Kinetic Sand
"Crayola Art Supplies, Drafting Tool (75-2462)",4.5,Crayola Art
TAMASHII NATIONS Bandai Figuartszero Enma The Kotobuki Squadron in The Wilderness Statue,34.17,TAMASHII NATIONS
"Noch 21512 Hedge Light Grn 15X8Mm 2/ H0,Tt,N Scale Model Kit",12.15,Noch 21512 Hedge
Trends International I Can & I Will - 4 Color Decal 4 X 8,4.68,Trends
Carson MagniFlip Plus 2.5X/5X/7X Flip-Open Magnifier with Built-in Protective Case (GN-44 or GN-44MU),6.45,Carson MagniFlip
Didax Educational Resources Write-On Wipe-Off Clocks (5),11.37,Didax
uxcell 4Pcs 8 x 4.5R Two Blades CW CCW Propellers w Locating Rings Black,7.64,
"Roma Costume 3 Piece Mousey Mistress Costume, Red/Black, Small/Medium",49.16,"Red/Black, Small/Medium"
"Losi Rear Bumper Pack: TEN-SCTE, LOSB2417",21.59,Losi Rear Bumper
Savox Servos SGSW1210SG Servo Gear Set with Bearings for SW1210Sg,29.99,Savox Servos
Star Wars: Edge of the Empire - Special Modifications,26.19,Star
Angeles MyRider Easy Rider,196.19,Angeles MyRider
Emon Toys Reikenzan: Rurisen 1:8 Scale PVC Figure,82.6,Emon Toys
"Tamiya America, Inc Polycarbonate PS-29 Fluorescent Pink, Spray 100 ml, TAM86029",10.75,Tamiya
"CGSignLab |""Keep Out -Ghost Aged Brick"" Window Cling | 8""x8""",14.99,CGSignLab
Yu-Gi-Oh! Cards: 2018 Holiday Mystery Box- Featuring Legend of Blue Eyes White Dragon | Factory Sealed Packs | Hot Box with Vintage Card 1:5,24.98,
Great Eastern Entertainment Accel World Logo PVC Keychain,5.93,Great Eastern
Scene Scapes - Miniture Figures - Horses (6Pcs/pk) - HO Scale,12.5,Scene Scapes -
amscan Premium Heavy Weight Plastic Spoons | Chocolate Brown | Party Supply | 240 ct.,45.99,Party Supply
Educational Insights Kanoodle Game Collection,51.34,Educational
Tequilla Sunrise Costume,30.86,Tequilla Sunrise
Privateer Press Hordes - Legion - Raek Light Warbeast Model Kit,19.46,Privateer Press
"Wood Eats! Marvelous Mixer Playset with Sugar, Milk, Flour and Egg",19.73,Wood
"FOCO Disney Cars Diztracto Spinnerz Three Way Set-Mater Spinner Toy, Tan, 3"" x 2.75""",5.45,FOCO Disney Cars
KidKraft Tabletop Easel - Espresso with Brights,23.99,KidKraft
"Klear Vu Tyson XL Overstuffed Fabric Cushion Large Chairs, 17"" x 17"", Single Pad, Green",18.99,Single Pad
EuroGraphics Party Time Birthday 60 Piece Puzzle,11.99,EuroGraphics Party
MightySkins Skin Compatible with Blade 200QX Quadcopter Drone wrap Cover Sticker Skins Outer Space,14.99,MightySkins Skin Compatible
Creative Playthings Half Bucket Swing (with Chain),47.0,Chain
Disney Pixar Toy Story 3-in-1 Buzz Lightyear Armor Pack,78.53,Disney Pixar Toy
"Baby Doll Bedding Forever Mine Junior 5 Piece Window Valance Curtain Set, Yellow",4.32,Baby Doll
Melissa & Doug Jumbo ABC Wooden Chunky Puzzle (26 pcs),13.46,Melissa & Doug Jumbo
"Rubie's Costume Batman v Superman: Dawn of Justice Armored Batman Child Top, Small",9.33,Rubie's Costume
Monster Hunter - Merarou & Poogie Teacup Button 1.25'',2.99,Monster Hunter -
MightySkins Skin Compatible with DJI Phantom 3 Professional Quadcopter Drone wrap Cover Sticker Skins Mixtape,39.99,MightySkins Skin
Ceaco Perfect Piece Count Puzzle - Fairyhouse - Sunflower Cottage,14.99,Ceaco Perfect
"Ingenuity Premium Soft Plush Soothing Bean Bag Lovey - Nate The Teddy Bear, Ages Newborn +",12.99,Ingenuity
"Intelex Warmies Microwavable French Lavender Scented Plush, Black & White Cow Warmies",19.9,Black & White
"School Zone - Owl Stuffed Animal Plush Toy ""Socrates"" - Ages 1 Month+, Ultra Soft, Creative Play, Imagination, and More (Charlie & Company)",10.58,Ultra Soft
"Roma Costume 3 Piece Mousey Mistress Costume, Red/Black, Medium/Large",49.95,"Red/Black, Medium/Large"
Sweet Jojo Designs Ballet Dancer Ballerina Queen Kids Children's Bed Skirt,36.99,Sweet Jojo
Mega Construx Pokemon Froakie Vs. Dedenne,14.99,Mega Construx
"Amscan 841254 Costume, Standard, Black",20.16,Standard
"Princess Paradise Dragon Skeleton Child's Costume, Large",56.44,Princess
STIGA Ottawa Senators Table Rod Hockey Players,111.99,STIGA Ottawa
Wallmonkeys Cute Baby Blue Cartoon Wall Decal Peel and Stick Graphic (36 in W x 26 in H) WM308169,39.96,Wallmonkeys Cute
HQ Kites and Designs 117528 Scout III 5.0 Kite,438.61,HQ Kites and
"Dickie Toys Air Pump Action Mobile Crane Truck, 12""",14.99,Dickie Toys Air
"Lab Rat Gifts""Matt The Rat"" Plush Toy",9.95,Lab Rat
Disney Pixar Toy Story 4 Buzz Lightyear Rapid Disc,12.49,Disney Pixar Toy Story
Traxxas 7918 Aton Red Roll Hoop Canopy,8.34,Aton Red Roll Hoop Canopy
"Northstar 275300 NUMBER 0 - MAGENTA, 16"", Pink",4.74,Northstar 275300
"Adventure Series 23"" Children's Corner Writing Desk Edge Trim Color: White, Surface Color: White",119.0,Adventure
"Rollerblade Macroblade 84 ABT Men's Adult Fitness Inline Skate, Black and Red, Performance Inline Skates",259.99,Rollerblade
DREAMWORKS TROLLS World Tour 11-Piece Poppy Styling Head,19.99,DREAMWORKS TROLLS World
Signs 4 Fun Nsaidu Undertaker's Driver's License,15.0,Driver
"Forum Novelties Patriotic Party Uncle Sam Costume, Child Large",14.02,Forum Novelties
ThreeZero Ghost in The Shell Movie Major 1:6 Scale Figure,101.04,Shell Movie
"Paw Patrol Little Boys' Toddler Short Sleeve T-Shirt, Heather Grey, 2T",8.22,Paw Patrol
"Fisher-Price Imaginext DC Super Friends, Gotham City Jail, Standard Packaging",25.0,Fisher-Price
Application Hello Kitty Head Shot Back Patch,14.66,Application
"California Costumes Killer Klown Child Costume, Large",26.11,California
Peppa Pig Little Rooms Dress Up Playset,9.99,Peppa Pig Little
"Amscan Dream Big Disposable Paper Dessert Plates Graduation Party Tableware, Round, 7"", Pack of 60. Party Supplies, Multi Color",12.89,Amscan Dream Big
"Axial AX31178 Method RC Rock Crawler 12-Spoke Beadlock Wheels with IFD (Interchangeable Face Design) and Hub Adapters, Black (Set of 2): AXIC8076",26.22,Axial AX31178
"Wild Republic Unicorn Plush, Stuffed Animal, Plush Toy, Lavender L'Il Sweet & Sassy 5 inches",8.04,Plush Toy
Rubie's Bat Wings Pet Accessory,4.53,Rubie's Bat
"""Pittsburgh Steelers Collection"" Party Invitations & Thank You Card Sets",12.34,
DC Batman vs Superman 3D Foam Blind Bags,6.99,DC Batman
"Tamiya America, Inc 1/35 US Main BattleTank M1A2 SEP Abrams TUSK II, TAM35326",55.14,Tamiya
Forum Novelties Women's Lace Rhinestone Venetian Half Mask with Sunglass Arms,19.0,Forum Novelties
"Rubie's Child's Tokidoki Costume, Dia De Los Muertos Caramelo Unicorno, Medium",14.0,Rubie's Child's
amscan Blonde Envy Wig,23.11,
"Hampton Nautical 3xglass-101 Boatswain (Bosun) 5"" w/Rosewood Box-Nautical Whistle-Oil Rubbed Bronze",26.9,Hampton
Rubie's Lovable Elli Phant Baby Costume,24.99,Rubie's Lovable
Us Flight Deck WW2 Section. 1/48th,24.99,Us Flight Deck
"Thomas & Friends Fisher-Price Trackmaster, Rebecca with Fisher-Price Wonder Makers Airport Hanger",20.43,Fisher-Price
Mary Meyer FabFuzz Natalie Narwhal Soft Toy Friend,17.8,Mary Meyer
Redcat Racing 50100 Cap Head Mechanical Screws (310) 8Piece,8.36,Redcat
Monogram Online AP-T220-4 Customized Happy Kids Sleeping Pillowcase,19.25,Monogram Online
DREAM COLLECTION Play Food Basket - 40Piece,9.99,DREAM COLLECTION
"3B Scientific A18/21 Mini Human Spinal Column Model - Flexible, On Base, 17.3"" Height",105.44,
"Losi Air Filter Foams, Pre-Oiled: 8B, 8T, LOSA9151",10.99,Losi Air Filter
"MAC-T PE07211 ""Soft Skin"" 2-1/2 in. Diameter Extra Durable Foam Ball, Super 70, All Grade Levels (Set of 6)",17.86,MAC
"Trends International DC Comics Movie - Batman v Superman - Fear The Bat Wall Poster, 14.725"" x 22.375"", Silver Framed Version",27.78,Superman - Fear
"MightySkins Skin Compatible with DJI Mavic Air Drone - Solid Olive | Min Coverage | Protective, Durable, and Unique Vinyl Decal wrap Cover | Easy to Apply, Remove, and Change Styles | Made in The USA",24.99,MightySkins Skin Compatible
"Forum Novelties Girl 64209 Big 50th Birthday Headband, One Size fits Most, Pack of 1, Multi-Color",5.48,Forum Novelties
K2 Skate Men's Kinetic 80 Pro Inline Skate,99.95,K2 Skate Men's
"Fisher-Price Disney Mickey & the Roadster Racers, Mickey Hot Rod Supercharged",3.99,Fisher-Price
"Critter Piller NCAA Kid's Travel Neck Pillow, Alabama Crimson Tide Grey Elephant",15.99,Critter Piller
BePuzzled Mickey/Minnie Gearshift Puzzle (4 Pieces),13.4,BePuzzled
Blade BLH9601 Main Control Board: Inductrix Hobby Rc Vehicle Accessories,59.99,BLH9601 Main Control Board
"Laser Pegs Helicopter 8-in-1 Building Set; The First Lighted Construction Toy to Ignite Your Child's Creativity; It's Your Imagination, Light It Up",22.99,Laser Pegs
"Borders Unlimited Sports Phrases Sudden Shadow, Mutli",24.99,Mutli
Avengers Marvel Endgame Titan Hero Marvel’s War Machine,14.99,Avengers Marvel
"Bandai Hobby MG Gundam Second Revise Model Kit (1/100 Scale), Astray Blue Frame",51.47,Bandai Hobby MG
Cabbage Patch Kids Adoptimals - Plush Pet Dog (Bulldog),21.36,Cabbage Patch
"Darice Color-In Puzzle - 8.5 x 11 inches, 48 pieces",5.28,Darice Color-In
Thermo Fisher SCI/Erie SCI 5951PLUS006-DS Daigger Premium Glass Microscope Slides Color Frost Plus Blue (Pack of 1440),770.01,SCI/Erie SCI
Daron Herpa Ground Equipment New Colors Building Kit (19-Piece),30.99,Daron Herpa
"Glass Go Stones, 8mm, Green",67.46,Glass Go
Spektrum SR6100AT 6-Channel DSMR DSM2 Receiver (RC Surface) with AVC and Telemetry: SPMSR6100AT,199.99,AVC
MightySkins Skin Compatible with Blade 350 QX3 Quadcopter Drone wrap Cover Sticker Skins Wood Style,24.99,MightySkins Skin Compatible
"Posh Stuffable Kids Stuffed Animal Storage Bean Bag Chair Cover - Childrens Toy Organizer, X-Large 48"" - Canvas Stripes Blue and White",24.95,Posh Stuffable
MightySkins Skin Compatible with Blade 200QX Quadcopter Drone wrap Cover Sticker Skins Baseball,14.99,MightySkins Skin Compatible
Ertl Farm Country Grain Feed Set,32.99,Ertl Farm
Bachmann Industries Ballast Spreader (HO Scale),21.43,Bachmann
Glittered Spiral Birthday Candles | Blue | Party Supply,11.65,Glittered Spiral
Zip Dry Minis - 6 Pieces,9.49,Zip Dry
Snow White and The Huntsman Deluxe Ravenna Skull Dress Tween Costume - Small,46.62,Snow White and
DJECO The Day Giant Floor Jig Saw Puzzle,14.99,DJECO The Day
"Wild Republic Audubon Birds Mallard Duck Plush with Authentic Bird Sound, Stuffed Animal, Bird Toys for Kids and Birders",8.0,Wild Republic Audubon Birds
"AdTech 05674 Permanent Crafter's Tape Refills, single unit",8.93,AdTech 05674
Sax True Flow Water Soluble Block Printing Ink - 16 Ounces - Magenta - 1299775,20.07,Sax True Flow
Redcat Racing 8 x 12 x 3.5 Ball Bearings (6 Piece),11.6,Redcat
Boston Celtics 3D Brxlz - Logo,19.99,Boston Celtics 3D Brxlz - Logo
"Trends International PJ Masks Standard Stickers - 4 Sheet, Multi",4.99,Trends
Blade PropCW & CCW Rotation Red: 350 QX,5.49,Blade PropCW & CCW Rotation
Waldman House Pr Peef 12 Inch Plush Bear,15.5,Waldman House Pr
Disney Pixar Cars Mini Racers Crank & Crash Derby Playset,27.85,Disney Pixar
O'Brien Lotus 8' Deluxe Inflatable Water Yoga Mat,486.89,O'Brien Lotus 8'
"Pacific Play Tents 95400 Kids School Bus 6 Foot ""D"" Tunnel Playhouse for Indoor / Outdoor Play - 60"" x 30"" x 30""",60.0,Pacific Play
PATIFIX Stained Glass Window Film self Adhesive Multicolor,8.53,PATIFIX Stained
"Wild Republic Anaconda, Great White, Hammerhead, Push action motor vehicle, Gifts for Kids, Imaginative Play, Motor Headz, Aquatic 5 Inches",9.99,Hammerhead
"Forum Novelties Kids Astronaut Costume, Multicolor, Small",6.72,Forum Novelties
