asin_name,asin_value_usd,brand
"DB Longboards CoreFlex Crossbow 41"" Bamboo Fiberglass Longboard Complete",237.68,DB Longboards
"Electronic Snap Circuits Mini Kits Classpack, FM Radio, Motion Detector, Music Box (Set of 5)",99.95,Motion Detector
"3Doodler Create Flexy 3D Printing Filament Refill Bundle (X5 Pack, Over 1000'. of Extruded Plastics! - Innovate",34.99,Extruded Plastics
Guillow Airplane Design Studio with Travel Case Building Kit,28.91,Guillow Airplane
Woodstock- Collage 500 pc Puzzle,17.49,Puzzle
"Terra by Battat – 4 Dinosaur Toys, Medium – Dinosaurs for Kids & Collectors, Scientifically Accurate & Designed by A Paleo-Artist; Age 3+ (4 Pc)",18.66,A Paleo-Artist
"Rubie's Child's Pokemon Deluxe Pikachu Costume, X-Small",29.12,Rubie's Child's
"Hoffmaster 120813 Double-Tipped Triangular Crayon, 88 mm Length, Wrapped (500 Packs of 2)",97.68,
"ARTSCAPE Etched Glass 24"" x 36"" Window Film, 24-by-36-Inch",12.99,ARTSCAPE Etched
Pokemon TCG: Sun and Moon Crimson Invasion Elite Trainer Box,38.49,Pokemon TCG:
"Moonlite, 3-Story Bundle for Boys, Includes 3 Story Reels for Use with Storybook Projector",18.16,
DC Cover Girls: Black Canary by Joëlle Jones Statue,84.61,DC Cover
"Baby Doll Bedding Chevron Window Valance and Curtain Set, Orange",33.92,Baby Doll
"LEGO Minecraft Creeper BigFig and Ocelot Characters 21156 Buildable Toy Minecraft Figure Gift Set for Play and Decoration, New 2020 (184 Pieces)",14.99,LEGO Minecraft Creeper BigFig
C&D Visionary DC Comic Originals Flash Logo Sticker,4.99,C&D Visionary DC
"The Learning Journey ABC Melody Maker, Primary",34.39,The Learning
"The Complete Common Core: State Standards Kit, Grade 5",12.88,The Complete
Flash Furniture 25''W x 45''L Trapezoid Red HP Laminate Activity Table - Height Adjustable Short Legs,117.26,Flash
Schylling Veterinarian Kit,9.39,Schylling
Yellies! Frizz; Voice-Activated Spider Pet; Ages 5 & Up,17.85,
Disney HK318329 Sofia The First Sleepover Set,27.5,Disney HK318329
Team Associated 9665 Hinge Pin Brace with Hinge Pins B4/T4,10.99,Team
"PLUS PLUS - Construction Building Toy, Open Play Set - 3,600 Pieces with Storage Tub - Basic Color Mix",159.99,PLUS PLUS -
"Big Party Pack Orange Peel Plastic Plates | 10.25"" | Pack of 50 | Party Supply",12.63,Party Supply
Peppa Pig Shape Sorter Clock Puzzle (12Piece),11.88,Peppa Pig Shape
NKOK Sonic and Sega All Stars Racing Remote Controlled Car - Sonic The Hedgehog,26.99,NKOK Sonic
Industro Stainless Steel Hose Clamps,34.27,Industro
"Oopsy Daisy Birchwood Owl Growth Chart, Pink, 12"" x 42""",18.7,Oopsy Daisy
Springbok Puzzles - Christmas Wishes - 400 Piece Jigsaw Puzzle - Large 26.75 Inches by 20.5 Inches Puzzle - Made in USA - Unique Cut Interlocking Pieces - Big Pieces for Kids & Small Pieces for Adults,14.95,Piece Jigsaw Puzzle - Large
Franklin Sports Eye Black Stickers for Kids - Customizable Lettering Baseball and Football Eye Black Stickers - White Pencil Included,6.91,Football Eye Black Stickers -
Costume Sunglasses Clown from IT Sun-Staches Party Favors UV400,5.99,Sun-Staches Party
"Jay Franco Disney Frozen 2 Forest Spirit Twin/Full Comforter & Sham Set, Mutli",36.37,Mutli
TAMASHII NATIONS Bandai S.H. Figuarts Captain America & Tamashii Effect Explosion Avengers: Infinity War Action Figure,60.87,TAMASHII NATIONS
"Forum Novelties Union Officer Child's Costume, Medium",21.07,Forum Novelties
"Weiler 14506 Nylox Cup Brush, 6"", 0.40/80SC Crimped Fill, 5/8""-11 UNC Nut",73.58,UNC Nut
Disney Mickey Golf Ball Spinner Pewter Key Ring Key Accessory,8.44,Disney Mickey
"Anagram International 3085101 Go Team Megaphone Shop Balloon Pack, 29""",6.45,Anagram
"Happy Birthday Jointed Letter Banner, Under Construction",3.12,Happy Birthday
Funko Pop! Games: Persona 5 - The Joker (Styles May Vary),15.45,Funko
Klutz Decorate This Journal Toy,16.01,Klutz Decorate
Random Esoteric Creature Generator for Classic Fantasy Rpgs & Their Modern Simulacra,19.94,Random Esoteric
Bachmann Trains Great Northern Gondola,22.38,Bachmann Trains
"Disney's Alice in Wonderland, ""The Hatter's Mad"" Woven Tapestry Throw Blanket, 48"" x 60"", Multi Color",35.0,Disney
Pacific Play Tent Agility Dog Training Chute,37.98,Pacific Play Tent Agility
Barbie Babysitters Inc. Popcorn Set,9.93,Barbie
"Losi Ride Height Gauge, LOSA99173",11.99,Losi Ride Height Gauge
Melissa & Doug Disney Cinderella Rags to Riches Wooden Magnetic Game With 10 Magnetic Pieces and Wand,11.12,Magnetic Pieces
VTech Twist and Hug Koala Rattle,7.99,VTech Twist and
"LAMO 5"" Vinyl Figure - Legacy Gamers Dr Disrespect, Red",19.5,
"Marvel Avengers Assemble Captain America Costume T-Shirt with Mask, Small",10.36,Marvel Avengers
"Vallejo Game Color Sunblast Yellow Paint, 17ml",3.06,Vallejo Game
"Mudpuppy Unicorn Magic Activity Coloring Roll, Age 4+, Creative Fun with Coloring, Mazes, Spot The Difference and More, Includes 5 Colored Pencils, Easy to Store Unicorn Paper Roll",6.99,Mudpuppy Unicorn
Top Trumps Liverpool FC 18/19 Card Game,6.11,Top Trumps
Hot Wheels Track Builder Straight Track with Car AND Hot Wheels Race Case Track Set,19.98,Hot Wheels Track
"Wild Republic Mermaid Toy, Slap Bracelet, Gifts for Kids, Purple, Huggers 12""",7.99,Wild Republic
Melissa & Doug Annie Doll & Feeding Set Bundle,24.99,Melissa & Doug
"LeapFrog LeapStart Preschool 4-in-1 Activity Book Bundle with ABC, Shapes & Colors, Math, Animals",38.33,ABC
Sherlock Holmes - The Challenge of Irene Adler,16.43,Sherlock
Great Eastern Entertainment Boys Attack On Titan - Levi Wallet,24.53,Great Eastern Entertainment
Domez My Hero Academia 4-Piece Bundle,19.99,Domez My Hero
"Paw Patrol, Mighty Pups Charged Up Chase’s Deluxe Vehicle with Lights and Sounds",14.99,Chase
Alex Discover Button Art Activity Set Kids Art and Craft Activity,11.42,Alex Discover
DC Collectibles DCTV: Black Lightning Resin Statue,17.75,DC Collectibles
Rubie's Adult 2-Tone Costume Wig,14.73,Rubie's
Funko Pop! Rides: Mulan - Mulan On Khan,28.74,Funko
Flaghouse Chrome Bowling Ball Ramp,114.57,Flaghouse Chrome
"Trends International DC Comics Movie-Batman v Superman Wall Poster, 14.725"" x 22.375"", Premium Unframed",17.49,Trends
"Aurora World Sweet and Softer Perky Penguin 9.5"" Plush",12.29,Aurora World Sweet
Baby Alive Luv 'n Snuggle Baby Doll Blond,9.27,Baby Alive
Mega Construx Welliewishers Playful Playhouse Buildable Playset,22.99,Mega Construx
Aurora World Miyoni Poodle Pup Plush,14.41,Aurora World
"Squish-Dee-Lish Squishy Jumbo Toy, Squishies - Slow Rising Pup-Corn, Soft Kids Squishy Toys 86715",4.3,Squish-Dee-Lish
"Mon AMI Pink Piglet Ballerina Designer Plush Doll, Exquisite Craftmanship, Premium Quality, Cuddling, Collecting & Playing Toy, Baby or Toddler Gift 18"", Multicolor",34.49,Mon AMI Pink
Proline 1013214 Hyrax 2G8 Rock Terrain Truck Tires (2),30.36,Proline
RoomMates Curious George Peel and Stick Giant Wall Decal - RMK1082GM,11.0,RoomMates
NECA - Teenage Mutant Ninja Turtles (1990 Movie) Prop Replica,46.99,NECA
Hansa Ostrich Baby Plush,14.98,Hansa Ostrich
RPM 73162 Axle Carriers Black 1/16 Traxxas Black,12.99,RPM 73162 Axle
Mikasa VSO2000 FIVB Replica Volleyball,18.93,Mikasa VSO2000
The Corps Special Forces Action Figures & Vehicle Deluxe Playset (Packaging & Colors May Vary),29.99,The Corps
Creativity for Kids Clay Keychains,6.99,Creativity for
Herbaceous,14.01,
"Wild Republic Snake Plush, Snake Stuffed Animal, Plush Toy, Pet Snake, Sherbert, 54""",12.99,Plush Toy
"NPW-USA NPW67309 Drinking Buddies Dice Game, 6-Piece Set",10.99,NPW-USA NPW67309
Blade 130 S BNF Basic With Safe,186.06,Blade 130 S BNF
"Madame Alexander 8"" ICY Elegance Light Skin Tone Blue Eyes/Blonde Hair",129.95,Madame
NCAA Georgia Bulldogs Toy Puzzle Cube,10.49,NCAA
COBI Historical Collection M3 Grant Tank,39.9,COBI Historical
"Learning Resources Serve It Up! Play Restaurant, Pretend Restaurant Set, 35 Pieces, Ages 3+",23.74,Learning Resources Serve
"Amscan 120175 Banner, 8' x 6 1/2"", Multi Color",5.58,Amscan 120175 Banner
"Melissa & Doug K’s Kids Whose Tail? 8-Page Soft Activity Book, The Original (Great Gift for Girls and Boys - Best for Babies and Toddlers, All Ages)",12.99,Melissa & Doug K’s
"Bachmann Old-Time Box Car - Pennsylvania LINES - N Scale, Prototypical Oxide Red",25.96,Bachmann
Jumbo Foil Star Cutout (gold) Party Accessory (1 count),15.39,Jumbo Foil Star Cutout
Aquarius I Heart Unicorns Playing Cards,8.53,Aquarius I Heart
"Great Eastern Mega Man X4 9"" Plush",17.57,Great Eastern
"Robinson Racing Products Robinson Racing 1710 Hardened 10T Pinion Gear 32P, Brown/A",3.64,Robinson Racing
Maisto R/C 1:14 Scale Lamborghini Huracan Radio Control Vehicle (Colors May Vary),38.55,Maisto
Aquarius DC Wonder Woman Retro Playing Cards,6.47,Aquarius DC
"MightySkins Skin Compatible with Parrot Bebop 2 – Slow Sloth | Protective, Durable, and Unique Vinyl Decal wrap Cover | Easy to Apply, Remove, and Change Styles | Made in The USA",24.99,MightySkins Skin Compatible
"Martha Stewart Crafts Stencil Tape, 32292",9.97,Martha Stewart
LEGO Friends Heartlake Surf Shop 41315 Building Kit (186 Pieces),19.99,LEGO Friends
amscan Thank Yous | Hello Kitty Collection | Party Accessory,9.22,Party Accessory
"Great Pretenders Fairy Blooms Deluxe Dress with Wings, Green, Medium",34.99,Great Pretenders
"Thames & Kosmos Chem C2000 (V 2.0) Chemistry Set with 250 Experiments and 128 Page Lab Manual, Student Laboratory Quality Instruments & Chemicals",107.86,Thames & Kosmos
"The Doll Maker Precious Moments Dolls, Linda Rick, Lion, Lion of Courage, Wizard of Oz, 7 inch Doll",22.0,The Doll Maker
Swing-N-Slide Blue Child Seat,15.99,Swing-N-Slide
Kid O Myland UFO & Alien Light Interactive Learning Toy,19.99,Kid O Myland
"Hasbro Little Pony Rainbow Dash Cuddle Pillow, Large, Blue",30.82,Hasbro Little
Jay Franco Nickelodeon JoJo Siwa Sweet Life Curtain/Drapes,19.99,Jay Franco
Play-Doh Poop Troop Set with 12 Cans,13.71,Cans
Marvel Select: Hulk Unleashed Action Figure,22.28,Marvel
Firefly: The Game - Esmeralda Game Expansion,12.5,
Gym Dandy Teeter-Totter Home Seesaw Playground Set TT-210,105.81,Gym Dandy
Ultra Pro Gamers Bag - Red,74.96,Ultra Pro Gamers
"American Educational Vinyl Clever Catch Elementary Science Insects Ball, 24"" Diameter",17.4,American
Banpresto 35783 My Hero Academia Enter The Hero Izuku Midoriya Figure,25.95,Banpresto 35783
"Delta Children Bistro 2-Piece Chair Set, White with Driftwood",99.99,Delta Children
Nations The Dice Game Unrest Expansion,36.91,Nations The Dice
Educational Insights Nancy B's Science Club Binoculars and Wildlife Activity Journal,11.24,Educational
"Educational Insights Alphabet Transparent Stamps- Uppercase 5/8""",11.12,Educational
Enchantimals Styling Head- Brown Mailer,18.59,Enchantimals
Spirit Riding Free Small Doll & Horse Set - Abigail & Boomerang,15.98,Spirit Riding
Click N' Play Military Logistics Transport Unit 16 Piece Play Set with Accessories.,18.99,Click N' Play
HiTec RCD 55013 HS-65HB Mighty Karbonite Feather Servo,8.99,HiTec RCD 55013
"Canal Toys Power Dough Unicorns Interactive Dough (11Piece), Multicolor",6.74,Canal Toys Power
COBI Small Army DW Twin-Turret Tank,51.39,COBI Small Army
Trend Enterprises Division 0-12 All Facts Skill Drill Flash Cards,10.94,Trend Enterprises Division
Hitec RCD 44212 X4 Micro AC/DC 1 Cell LiPo Charger,43.48,X4 Micro AC/DC 1 Cell
"Craft-tastic – Kindness Kit – Craft Kit Includes 8 Projects to Inspire Kindness, Bilingual",19.99,
"Corolle Bebe Bath Oceane - 12""",39.47,Corolle Bebe
"MasterPieces John Wayne Jigsaw Puzzle, America's Cowboy, Legendary Collection, 1000 Pieces",12.99,Cowboy
"Perler 80-22860 Instruction Pad for Fuse Beads, 86 Patterns, Summertime Fun Piece",5.99,Perler 80-22860
Tiny Arcade Pole Position,16.82,Tiny Arcade Pole Position
WWE Rey Mysterio Elite Collection Action Figure,25.99,WWE
Original 3D Crystal Puzzle - Swan,9.6,Original 3D
"Dark Horse Deluxe The Umbrella Academy Playing Cards, Multicolor",4.99,Dark Horse Deluxe
"Strawberry Shortcake Classic Doll, 6""",12.89,Strawberry
"Darice Doll Hat: Black Felt Top Hat, 2 inches, 1 Piece",4.35,Darice Doll
"Sugarbooger Silicone Teether Set-of-Two, Happy Cactus",16.72,Sugarbooger
"Wild Republic Horse Plush, Stuffed Animal, Plush Toy, Gifts for Kids, Cuddlekins, Brown 12 Inches",16.22,Plush Toy
LEGO Technic Power Functions Motor Set 8293 (10 Pieces),28.82,LEGO Technic
"WalthersTrainline Ready to Run Union Pacific #908814 Firefighting Car, Green/Black",17.98,Union Pacific
Punto Tin -The Pt.-to Pt. Card Game,9.99,Punto Tin -The
"SpongeBob SquarePants, Masterpiece Memes, 8” Collectible Vinyl Figure, Handsome Squidward (Closed Eyes)",20.76,SpongeBob SquarePants
Melissa & Doug Bella Butterfly Net,6.99,Melissa & Doug
Pokemon 3 Inch Alolan Muk Articulated Battle Action Figure,10.4,Pokemon 3 Inch
"Jada Limited Edition 4"" METALFIGS - Power Rangers - RED Ranger M334 99270",16.95,Jada Limited
Vallejo Imperial Rome Era Paint Set,42.99,Vallejo Imperial
Indie Boards and Cards Flash Point Fire Rescue 2nd Story,14.99,Indie Boards
Dremel 7103 5/64-Inch Diamond Wheel Point,6.96,
"American Greetings My Little Pony Swirl Decorations, 12-Count, Multicolored - AMI 675513",7.9,American Greetings
Lightseekers Trading Card Game Intro Pack,7.99,Lightseekers
"Amscan Party Supplies, Multicolor",5.7,Amscan Party Supplies
Nuts,9.95,
Carson Dellosa Key Education Verbs: Actions Learning Cards (845005),12.47,Carson Dellosa
theory11 Product(RED) Playing Cards,8.29,
Disney Pixar Cars Trainer Cruz Ramirez,3.99,Disney Pixar
Mudpuppy Bonjour Paris! Magnetic Figures,14.77,Magnetic Figures
"Fashion Angels We Smell Sweet Bracelet Kit, Assorted",13.87,Fashion Angels
"Mayflower Distributing Company 55270 U OF VIRGINIA - BEV NAPKIN 24CT, One size, Multicolor",12.86,Mayflower
Forum Novelties Men's Adult Suede Cowboy Hat,14.99,Forum Novelties
DC Collectibles DC Artists Alley: Wonder Woman by Chris Uminga Limited Edition Vinyl PVC Figure,19.95,DC Collectibles
Carrera 23856 Ferrari 512 S Berlinetta Scuderia Filipinetti #3 1970 Digital 124 Slot Car 1:24 Scale,75.01,Digital
"Nick Jr. Dora the Explorer Child's Dora Costume with Backpack, Small",23.74,Nick Jr.
"Amscan 399918 6 Piece Game Day Photo Props Kit, One Size, Multicolor",8.99,Amscan 399918 6
"Forum Novelties Men's Standard Adult All Wrapped Up Ugly Christmas Sweater, Naughty Stocking, Large",14.95,Forum Novelties
"Sport Squad HX40 40 inch Table Top Air Hockey Table for Kids and Adults - Electric Motor Fan - Includes 2 Pushers and 2 Air Hockey Pucks - Great for Playing on The Floor, Tabletop, or Dorm Room",67.95,Sport Squad
BeginAgain BuddyBlocks Safari Animals - Matching and Problem Solving - Kids 18 Months and Up,12.99,BeginAgain
"Skip Hop Bandana Buddies Baby Activity and Teething Toy with Multi-Sensory Rattle and Textures, Elephant",13.99,Teething Toy
"American Educational Inflatable World Globe, 24""",17.4,American
Gowi Toys Austria Police Van with Police Play Figures,11.16,Gowi Toys
Bendon Finding Dory Sticker Box,9.99,Bendon Finding
Playmobil My Café,39.99,Playmobil My
4M Glow-In-The-Dark 3D Dinosaur,6.63,
Battat – 3 Car Garage – Shape Sorting Toy Garage with Keys and 3 Toy Cars for Toddlers 2 years + (5-Pcs),22.24,
RoomMates My Little Pony Fluttershy Peel and Stick Giant Wall Decals,12.97,RoomMates My
Funko Pop! Marvel: Avengers Endgame - Iron Spider with Nano Gauntlet,9.95,Funko
"Transformers Toys Cyberverse Action Attackers: 1-Step Changer Skybyte Action Figure - Repeatable Driller Drive Action Attack - for Kids Ages 6 & Up, 4.25""",9.84,Transformers
"amscan Pretty Potion Witch Halloween Costume for Girls, with Included Accessories",51.12,Included Accessories
"Eureka Back to School Gold Glitter Star Stickers for Kids and Teachers, 72pc",6.58,Eureka Back to
Faber-Castell Creative Studio Goldfaber Aqua Watercolor Pencils - Tin of 12 Colors,9.51,Faber-Castell
Medicom Neon Genesis Evangelion: Eva Evangelion Unit 01 Shogo-Ki Maf Ex Action Figure,102.53,Medicom Neon Genesis
"Lionel FasTrack Electric O Gauge, O36 Curve Track, 4-Pack",21.99,O36 Curve Track
Rubies Devil Girls Child Red Demon Costume,19.92,Rubies Devil
"Bright Starts Rattle & Shake Barbell Toy, Ages 3 months +",2.88,Bright Starts
Pete The Cat Groovy Buttons Mini Stickers,5.43,Pete The Cat
"Disney Rapunzel Acrylic Key Ring, Multicolor",3.33,Disney Rapunzel
"Fisher-Price #Selfie Fun Phone, Baby Rattle, Mirror and Teething Toy",4.99,Fisher-Price
"LEGO Creator Expert Gingerbread House 10267 Building Kit, New 2020 (1,477 Pieces)",99.99,LEGO Creator
Folkmanis Standing Bear Hand Puppet,52.19,Folkmanis
Pro Series CLM-16 Red Plastic Scoring Pills for Kelly Pool in Hang Pack,3.9,Pro Series
Awesome Paw Patrol Bundle of 3 Pieces,8.52,Awesome Paw
Rubie's Suicide Squad Joker Teeth Adult Costume,7.73,Rubie's Suicide
"Papo Wild Animal Kingdom Figure, Cheetah with Cub",8.29,Cheetah
"3DLightFX Nickelodeon Tent, Leonardo's Katana",23.95,Nickelodeon Tent
"DC Lantern 2.75"" PVC Figure, Green",6.99,DC
"Nickelodeon's Dora and the Lost City of Gold Nickelodeon's Dora & The Lost City of Gold: Boots, Multicolor",23.4,Nickelodeon
"Star Wars: The Force Awakens Child's Stormtrooper Costume, Medium",12.88,Star
Ceaco Perfect Piece Count Puzzle - Thomas Kinkade Disney Dreams Collection - Beauty and the Beast,19.86,Ceaco Perfect
Disney Belle Soft Touch PVC Key Ring,4.99,Disney Belle
"Forum Novelties Prince Charming Child's Costume, Small",17.75,Forum Novelties
Rubie's Costume Dc Heroes and Villains Collection Joker Latex Mask,37.77,Rubie's Costume
"VTech Click and Count Remote, Black",9.96,VTech Click and
Daron United 747 Single Plane,10.18,Daron
"FOCO DC Comics Justice League Character Bobble, Superman",20.95,FOCO DC Comics
"amscan Frozen 2 Birthday, Metallic Blowouts, Party Favor, 7.25"", 8 Ct.",18.74,Metallic Blowouts
"BePuzzled Original 3D Crystal Jigsaw Puzzle - Wolf Animal Assembly Brain Teaser, Fun Model Toy Gift Decoration for Adults & Kids Age 12 and Up, Black, 37 Pieces (Level 1)",10.99,BePuzzled
TOMY John Deere Learn 'n Pop Farmyard Friends Toy,14.99,Pop Farmyard Friends Toy
Forum Novelties Jolly Elf Adult Costume,29.99,Forum Novelties
Melissa & Doug Disney Sofia the First and Princess Amber Magnetic Dress-Up Wooden Doll Pretend Play Set (40+ pcs),14.99,Melissa & Doug Disney Sofia
"Melissa & Doug Created By Me! Heart Beads Wooden Bead Set - The Original (Jewelry-Making Kit, Over 120 Beads, 5 Cords, Great Gift for Girls and Boys – Best for 4, 5, 6, 7 and 8 Year Olds)",8.92,Melissa & Doug Created
Eureka Educational Blue Harmony Assorted Diamonds (841357),6.69,Eureka
"Wild Republic Great White Shark Plush Stuffed Animal Toy, Gifts for Kids, Cuddlekins 20 Inches",14.99,Wild Republic
Privateer Press Warmachine - Convergence of Cyriss - Accretion Servitors Model Kit,10.33,Privateer Press
Entertainment Earth Designer Series Wonder Woman by Darwyn Cooke Action Figure,14.49,Darwyn Cooke Action
Entertainment Earth Batman Black & White 1st Appearance by Bob Kane Figure,15.51,Entertainment
"Stephen Joseph Cape, Unicorn",14.2,Stephen Joseph
Yu-Gi-Oh! Cards: Cyberse Link Structure Deck,9.75,
"Wild Republic Cuddlekin Three Toed Sloth 12"" Plush",12.99,Wild Republic
In the Breeze Silver Sparkle Tails,9.02,In the Breeze
X-Shot Chaos Orbit Dart Ball Blaster (100 Rounds) - Double Blaster Pack by Zuru,39.99,X-Shot Chaos Orbit
Transformers TCG: Bumblebee Vs. Megatron 2-Player Starter Set | 1 Ready-to-Play Deck | 44 Cards Incl. Bumblebee,12.5,Transformers
"EVAN-MOOR 4545 Skill Sharpeners Math Book, Grade 1, 0.5"" Height, 8.5"" Width, 11"" Length",12.64,Width
"Mrs. Grossman's Outer Space Reusable Sticker Activity Set, Multicolor",8.99,Outer Space Reusable Sticker
Bachmann Trains Norfolk and Western Flat Car,23.97,Bachmann Trains
Bigjigs Rail Wooden Fairy Town Train Set - 75 Play Pieces,87.0,Bigjigs Rail
"Lionel Racing, Chase Elliott, Napa Nightvision, 2018, Chevrolet Camaro, NASCAR Diecast 1: 24 Scale",54.99,Napa Nightvision
Calplush Safari Friends Black Panther Plush Animal Toy,5.61,Calplush Safari
Magic Cabin 25-Piece Carpenter's Essentials Set,35.83,Magic
"Safety 1st Rubber TempGuard, Ducky",8.0,Safety 1st
"Horizon Group USA Painting Panel Canvas Boards, 9x12, Pack of 12",14.99,Horizon Group USA Painting
Happy Trails Zebra Plush Rocking Animal,47.99,Happy Trails
"Wild Republic T-Rex Plush, Dinosaur Stuffed Animal, Plush Toy, Gifts for Kids, Dinosauria 17 Inches",14.4,Plush Toy
"Du-Bro 223 1/8"" x 2' Large Super Blue Silicone Tubing",5.54,Du-Bro
"Galison Joy to The World 1000 Piece Jigsaw Puzzle for Adults, Holiday Puzzle for Families with Festive Theme",16.99,Galison Joy to
"Marvel: Animated Spider-Man Movie Mile Morales Spider-Man Collectible Figure, Multicolor",10.99,
"Tamiya TAM58646 1/18 R/C Konghead 6x6 (G6-01) Kit, Brown",182.0,Tamiya
"Schleich North America Tyrannosaurus Rex Toy Figure, Red",21.24,Schleich North
Bachmann EMD 70ACe DCC Sound Value Equipped Diesel Locomotive - ILLINOIS TERMINAL #1072 (with operating ditch lights) - HO Scale,193.68,Bachmann EMD
"edx Education School Friendly Playing Cards - Jumbo Size - Set of 56 - Multicolored Patterned Cards Numbered 0-13 for Gameplay - Teach Number Concepts, Counting, Matching and Probability",25.39,
"Colorbok YPI50047 You Paint It Plaster Kit, Value Pack, Enchanted",10.18,Colorbok
Funko Pop! Keychain: Frozen 2 - Elsa,6.33,Funko
Rayne Longboards Demonseed Longboard Complete,249.95,Rayne Longboards
"K2 Skate Men's Kinetic 80 Pro Inline Skate, Black White, 10.5",89.98,K2 Skate Men's
Center Enterprise CE6620 Circular Washable Vivid Orange Stamp Pad,10.4,Center
Funko Pop Games: Fortnite - Tomatohead,9.99,Funko Pop
K’NEX – Turbo Jet – 2-in-1 Building Set – 402 Pieces – Ages 7+ – Engineering Educational Toy,28.97,
Kettler Advantage Indoor Table Tennis Bundle: 4 Player Set (4 Rackets/Paddles and 8 Balls),37.97,Rackets/Paddles
"Ravensburger Disney Princess Adorable Cinderella 100 Piece Glitter Jigsaw Puzzle for Kids – Every Piece is Unique, Pieces Fit Together Perfectly",13.99,Ravensburger
Folkmanis Mini Sitting Frog,17.0,Folkmanis Mini
"Funko Pop Marvel: Runaways - Molly Collectible Figure, Multicolor",7.77,Funko Pop
"Delta Children Plastic Toddler Bed, Nickelodeon SpongeBob SquarePants",58.49,Delta Children
Yoshi's Crafted World - Nintendo Switch,32.84,Yoshi
"Avengers Marvel Black Panther 6""-Scale Marvel Super Hero Action Figure Toy",9.25,Avengers Marvel
Swagtron Swagger 2 Plus Foldable Electric Scooter for Adults & Teens,199.99,Swagtron
"VTech Baby Lil' Critters Shake and Wobble Busy Ball Amazon Exclusive, Purple",14.99,VTech Baby Lil'
Wildkin Kids 17 Inch Backpack,25.89,Wildkin Kids 17
Barbie Dolphin Magic Snorkel Fun Friends,17.62,Barbie Dolphin
Melissa & Doug Pretend Play Wooden Star Diner Restaurant With 40+ Accessories and Play Food,188.47,Melissa & Doug Pretend Play
Mudpuppy Princesses Color in Crowns,13.46,Mudpuppy
WWE Rowan Elite Collection Action Figure,15.86,WWE Rowan Elite
DIAMOND SELECT TOYS John Wick Vinimate,9.99,DIAMOND SELECT
"Wild Republic Mountain Goat Plush, Stuffed Animal, Plush Toy, Gifts for Kids, Cuddlekins 8 Inches",9.99,Plush Toy
Pokemon TCG: Mega Camerupt EX Premium Collection Box,33.99,Pokemon TCG:
Sun-Staches Costume Sunglasses Incredibles Edna Mode Glasses Party Favors UV400,9.99,Sun-Staches
AMERICAN GREETINGS Bright Colors Latex Balloons | Pack of 15 | Party Decor,5.0,Party
GreenBrier Games Yashima Legends from Fairytale Board Game,35.0,Fairytale Board Game
Bachmann Industries New Haven 50' Plug Door Box Car,18.81,Bachmann Industries New Haven
"HARRY POTTER Collapsible Storage Cubes 2 Pack, Red",8.91,HARRY POTTER
"Animal Adventure | Popovers Travel Pillow | Orange Fox | Transforms from Character to Travel Pillow | 13"" x 8.5"" x 6",11.49,Orange Fox
Plush Royal Crown (purple) Party Accessory (1 count) (1/Pkg),8.99,Party Accessory
Wind-Up Walking Families - Duck Family,4.72,Wind-Up Walking
"Melissa & Doug Kids Furniture, Wooden Table & 4 Chairs (White Table, Pastel Pink, Yellow, Green, Blue Chairs, 20.5” H x 23.5” W x 20” L, Great Girls and Boys – Best for 3, 4, 5, 6, 7 and 8 Year Olds)",143.99,Melissa & Doug Kids Furniture
Hey! Play! Kids Pop-up Six-sided Ball Pit Tent,11.99,
Bandai Hobby MG 1/100 Gunner Zaku Warrior (Lunamaria Hawke Custom) Gundam Seed Destiny,44.5,Bandai Hobby
DIAMOND SELECT TOYS Batman The Animated Series: Ra's Al Ghul Resin Bust Figure,56.95,DIAMOND SELECT
"Sticko 450188 Stickers, Shimmery Stars",1.89,Sticko 450188
"Step2 2-in-1 Toy Box & Art Lid | Plastic Toy & Art Storage Container, Grey",52.44,Toy Box & Art Lid
"9"" SOCCER BALL INFLATE",8.02,
PRINZ Man Money Curse Fund Piggy Bank,16.0,PRINZ Man Money
"Adora ToddlerTime Girl Doll, Macaraccoon, Weighted Vinyl Baby Doll Toy with Soft Body, 20-inch (Ages 6+)",86.49,Adora
"Ergobaby Metro Compact City Stroller Accessories, Backpack-Style Carry Bag",30.0,Backpack-Style Carry Bag
"LIL TOTS Princess 14"" Doll & Unicorn Set",26.99,LIL TOTS
"Discovery Layers of The Earth Geology Sand Dig Kit by Horizon Group USA, 3-in-1 Earth Exploration",19.99,Horizon Group USA
"GUND Baby My First Christmas Reindeer Lovey Plush Blanket, 12"", Brown",13.79,GUND Baby My
Power Rangers 97376 Blaster Role Play,62.93,Power
"Celebrity 24DCL 24"" Latex Balloons, Clear (Pack of 10)",13.89,Latex Balloons
Emoji Pals Kissy Kids Saucer Chair,37.45,Emoji Pals Kissy
"Creativity for Kids My First Fun Felt Shapes - Travel Friendly Felt Board for Toddlers (Imaginative Pretend Play for Kids, 100+Piece)",12.15,Creativity for
"Melissa & Doug Mine to Love Jordan 12” Baby Doll (Includes Romper, Cap, Pacifier, Great Gift for Girls and Boys - Best for Babies, 18 Month Olds, 24 Month Olds, 1 and 2 Year Olds )",16.82,Melissa & Doug Mine
Darice 9163-46 Wood Airplane Craft,6.23,Darice 9163-46
"University Games Break Out Game, Kids",11.12,University Games
"Anna Frozen Fever Deluxe Costume, One Color, 3T-4T",34.99,Anna Frozen
Crawl N Play,37.99,Crawl N
Bicycle Rider Back Playing Cards,3.49,Bicycle Rider
