asin_name,asin_value_usd,brand
Creeper Inflatable Child Costume,71.99,Creeper
Costume Sunglasses Stitch Sun-Staches Party Favors UV400,31.0,Costume
"Losi Diff Gear Set w/Hardware: TENACITY ALL, LOS232029",9.25,Losi Diff Gear
Fireside Games Grackles - Board Games for Families - Board Games for Adults,18.44,Fireside Games
PartyWoo Valentines Day Balloons 12 inches Printed Heart Balloons 50 Packs for Wedding Decoration Baby Shower Birthday Decoration - Printed Heart,8.78,PartyWoo
Classic Christmas Santa’S Workshop Puzzle - 1000Piece,12.99,Workshop Puzzle - 1000Piece
Big Time Toys Socker Bopper Power Bag Standing Inflatable Punching Bag for Kids,11.9,Big Time Toys
Sassy Ring Rattle | Developmental Baby Toy for Early Learning | High Contrast | For Ages Newborn and Up,4.56,Sassy Ring
"18"" Doll Guitar & Microphone Set - Includes Doll Clothes - Fits American Girl Dolls",9.99,
Disney 2-in-1 Battery-Powered Frozen Train with Caboose & Tracks,99.99,Disney 2-in-1
Modiphius Games Star Trek Adventures Starter Set,26.93,Modiphius Games Star
PJ Masks Mission Control HQ,29.99,PJ Masks Mission Control HQ
"Foamnasium 1075 Big Wacky Sack, Multi-Colored, Large 36",15.26,Multi-Colored
"Enchantimals Larissa Lemur & Ringlet Dolls AND Mattel Enchantimals Tamika Tree Frog & Burst Dolls, Multi Color",9.99,Mattel Enchantimals
Great Explorations Colorful Stars Super Kit,10.37,Great
Monkey Business Sports Original Spiderball,10.66,Monkey Business
"Sauder Harbor View Bin Bookcase, Salt Oak finish",73.78,Sauder Harbor
DRIVEN by Battat – Micro Bulldozer – Detailed Toy Bulldozer with Movable Parts and Realistic Sounds for Kids Age 4+,9.49,Battat – Micro Bulldozer
"Filmcells Batman Begins Minicell Framed Art, S2",59.03,Filmcells Batman
Legend of the Five Rings Beginner Game,34.99,Legend of the
"Funko Pop! Tee: Secret Life of Pets 2 - Super Snowball Shirt, Size XS",6.48,Funko
TeeTurtle Reversible T-Rex Mini - Purple Plush Toys,11.09,TeeTurtle Reversible
ORB Soft'n Slo Squishies Jumbo Blue & Purple Ice Cream Cone,12.42,ORB Soft'n Slo
DC Collectibles DC Artists Alley: Batman by Nooligan Limited Edition Vinyl PVC Figure,34.99,DC Collectibles
"Shopkins Lippy Lips Plush - 12""",8.89,Shopkins Lippy
Fanci-Fetti 90 Silhouettes (multi-color) Party Accessory (1 count) (.5 Oz/Pkg),2.65,Fanci-Fetti
"Perler Beads Animal Craft Transparent Pegboard Set, 4 pcs",4.39,Perler Beads
"Metallic Red Mardi Gras Beads, 4ct",5.99,Metallic Red
Czech Games Dungeon Lords: Happy Anniversary,109.85,Czech Games Dungeon Lords
"REALBUG Spiny Spider Glow in The Dark Necklace, Small",9.01,REALBUG Spiny
Key Education Sight Word Space Station Board Game Early Learning Game105 Pcs. Carson-Dellosa 840001,19.99,Key Education
"Ravensburger Sneaker Graffiti Style Jigsaw Puzzle (108 Piece), Multicolor",22.45,Ravensburger
Daron Worldwide Trading Daron Skykids F/A-18 Hornet with Lights & Sounds Vehicle,19.99,Lights & Sounds
CMON Rum & Bones: Second Tide Board Game,63.49,CMON Rum & Bones
Care Bears Hug & Giggle Feature Cheer Plush,19.99,Care Bears Hug &
"Melissa & Doug Water Wow! Water-Reveal Travel Activity Pad 3-Pack - Flip Pad, Colors-Shapes, Mazes",12.3,Melissa & Doug Water
Fotorama Flush Game - New Version.,4.27,Fotorama Flush
Funko Pop! Games: Overwatch Action Figure - Reaper,10.8,Funko
"MightySkins Skin Compatible with DJI Inspire 2 - Flower Wheels | Protective, Durable, and Unique Vinyl Decal wrap Cover | Easy to Apply, Remove, and Change Styles | Made in The USA",67.37,MightySkins Skin Compatible
"Center Enterprises Inc. Ready2Learn Textured Stampers, 6/Pack",12.76,Center
EuroGraphics Seattle City Skyline Puzzle (1000-Piece),17.99,EuroGraphics
"Chic Home Forest 6 Piece Reversible Comforter Cute It's A Hoot Owl Friends Youth Design Bed in a Bag-Sheet Set Decorative Pillow Sham Included, Twin, Grey",64.97,Chic Home Forest
"Jet Creations Seal Inflatable 20"" Long for Gifts Toys Home Decor Party Favors & Supplies Kids & Adults an-Seal",3.99,Jet Creations
Manhattan Toy Natural Historian Butterflies & Moth Finger Puppet Play Set,7.99,Manhattan Toy
Imagine by Rubie's Guardians of The Galaxy Volume 2 Child's Groot Dress-Up Set Costume,22.31,Imagine by
"E-flite Park 450 Brushless Outrunner Motor, 890Kv, EFLM1400",48.76,E-flite Park 450
35789 Dragon Ball Super Battle with Dragon Ball Fighterz Android 17 Figure,31.37,
"Rubie's Child's Pink Crystal Ninja Costume, Large",25.14,Rubie's Child's
Flash Furniture Kids Colorful 5 Piece Folding Table and Chair Set - JB-9-KID-GG,45.74,Flash Furniture
"Learning Resources Farm Animal Counters, 10 Different Animals, Set of 60, Ages 3+",16.8,Learning
CMON Zombicide: Guest Keven Walker,19.13,CMON Zombicide
amscan Valentine 10 Color Plastic Pen | Party Favor,6.53,
"Forum Men's 3-d Printed Long-Sleeve T-Shirt, Elf",14.95,Forum Men's 3-d
Arkham Horror: Hour of The Huntress HC,11.96,Arkham
Little Colorado Personalized Child's Adirondack Rocking Chair- White,97.73,Little Colorado
"Champion Girls' Big Supercize Backpack, Pink/White, Youth Size",30.24,Champion Girls'
Green Couch Games Ladder 29 Game Firefighter Card Game,20.0,Green Couch Games
Sushi Go! - The Pick and Pass Card Game,8.95,Sushi
"Squishy Jumbo Toy, Wacky Squish-Dee-Lish Squishies - Slow Rising Poop, Soft Kids Squishy Toys",4.24,Squishy Jumbo
CMON Looterz Game Board Game,22.16,CMON Looterz Game Board Game
Polly Pocket Mini Mall Escape,10.15,Polly Pocket
Carson-Dellosa Publishing Differentiated Instruction Cubes,17.53,Carson-Dellosa
"Childcraft Sand Activity Set, 28 Pieces",89.18,Childcraft Sand
The Builders: Middle Ages,9.09,The
"Bugatti Chiron 12V Ride On Car. Premium Convertible Bugatti Chiron Style Ride on Car Kids Music,Lights, Doors, RC",389.99,Bugatti
Peter Rabbit Bunny On The Go Activity Toy,10.67,Peter Rabbit
"Tudor Games PSFB-2PK Electric Football Patriotic Bases - 24 Red Rookie, 24 Blue Total Team Control, Multicolor (Pack of 48)",19.5,Blue Total Team Control
The Learning Journey: My First Match It - Things I Eat - 15 Self-Correcting Food Themed Image Matching Puzzles,12.99,The Learning
Creativity for Kids Big Gem Diamond Painting Kit - Create Your Own Magical Stickers & Suncatchers - Diamond Art for Kids,14.99,Creativity for
Jurassic World Attack Pack Velociraptor Charlie,5.32,Jurassic World
"Aurora World 8"" Goat Kid Toy",7.75,Aurora
"Little Kids Fubbles Light Up Bubble Blaster Blows Tons of Bubbles for Kids Includes Bubble Solution, Green",7.99,Little Kids
Beistle CN038 Tropical Breeze Confetti,4.99,Beistle CN038
"ROYAL BRUSH Junior Small Paint by Number Kit 8-3/4""X11-3/4-Christmas Wish",9.09,ROYAL BRUSH Junior Small Paint
Disguise Toothless How to Train Your Dragon Hidden World Deluxe Boys' Costume,19.98,Disguise
PLAYMOBIL Mars Rover,9.99,PLAYMOBIL Mars
Great Eastern Entertainment Attack On Titan SD Mikasa Pu Keychain,12.0,Great Eastern
Melissa & Doug Playtime Foil Coloring Pad,4.99,Melissa & Doug
Zimpli Kids Glitter Slime Baff- 150G - 1 Use - Purple,9.23,Zimpli Kids
Snake Oil Game,15.94,Snake Oil
Factory Entertainment Forbidden Planet Tin Tote,22.34,Factory
Ravensburger Disney Toy Story: History Puzzle Set (3 x 49 Piece),11.99,Ravensburger Disney Toy Story
Daron Airbus Single Plane A380,9.99,Daron
Cardinal Games PJ Masks 6-in-1 Game House,14.99,Cardinal Games
"GUND Baby Toothpick Flamingo Plush Stuffed Animal 12"", Pink",16.85,GUND Baby
"Lion King Cuddle Pal Stuffed Animal Plush - Large Round Nala - 10""",14.78,Lion King Cuddle
"Tru-Ray Heavyweight Construction Paper Pad, 10 Assorted Colors, 9"" x 12"", 40 Sheets",10.1,Tru-Ray
Disney Princess Belle & Rapunzel Dress Up Trunk,29.99,Disney Princess
"green sprouts 3 Pack Fruit Cooling Teethers, Pink, Green, Purple",11.99,
PLAYMOBIL Fire Crane,22.95,PLAYMOBIL Fire
Manhattan Toy Skwish Natural Rattle and Teether Grasping Activity Toy,14.49,Manhattan Toy
"Mary Meyer Putty Nursery Soft Toy, Fox",16.5,Fox
Great Eastern GE-52716 Dragon Ball Z - Super Saiyan Goku Stuffed Plush,18.94,Great Eastern
Areaware Cubebot Medium (Natural),18.44,Areaware Cubebot
Sweet Jojo Designs Gray Queen Bed Skirt for Gray and Orange Stripe Collection Teen Bedding Sets,99.99,Sweet Jojo
Junior Learning Blend Readers Fiction Toy,19.99,Junior Learning
"All About Details CAT80YL 80-Years-Loved Cake Topper,1PC, 80th Birthday, Party Decor, Glitter Gold (Gold & Black), 6 x 8,",16.99,Gold & Black
White Mountain Puzzles Pennsylvania Craft Beer-1000 Piece Puzzle-Designer: Lois B. Sutton,15.99,White Mountain
Gms-125 Gundam Metallic Marker Set 2,17.0,Gms-125 Gundam
Professor Pengelly's Putty Thermo Reactive Sunset Red,13.93,Putty Thermo Reactive Sunset
"AMAV Toys 3D Unicron & Pegasus Painting Kit - All Inclusive & Ready to Paint - Enhance Creativity, Imagination & Improve Motor Skills - Best DIY Activity - Ideal Present for Unicorn Lovers Aged 3+",11.86,AMAV Toys 3D
Transformers Allspark Tech Autobot Drift,17.86,Transformers
Eurographics New England Christmas Stroll 1000-Piece Puzzle,20.64,Piece Puzzle
Black Powder Revolutionary War Field Artillery 1:56 Military Wargaming Plastic Model Kit,19.98,Black Powder
"Click N' Play Set of 8 Kids Pretend Play Beauty Salon Fashion Play Set with Hairdryer, Curling Iron, Mirror & Hair Styling Accessories with a Beauty Tote Bag",19.99,Click N' Play
American Girl Crafts Tech Case Sewing Kit,4.3,American Girl
"Magformers Sweet House 64 Pieces Pink and Purple Colors, Educational Magnetic Geometric Shapes Tiles Building STEM Toy Set Ages 3+",66.81,Magformers Sweet
Forum Novelties 5th Birthday Glitter Tiara,10.27,Forum
Tamiya RC Grand Hauler Toy,489.28,Tamiya RC Grand
"Fancy Nancy 77418 Fantastique Doll-Sized Vanity (6 Piece), Multicolor",13.13,Fancy
Funko POP Game of Thrones: Tyrion Lannister Vinyl Figure,8.1,Funko POP
Girls 50s Poodle Dress Costume Kids Rock N Roll Polka Dot Decades Outfit,29.95,Girls 50s Poodle
"Disney Minnie Dessert Plates Birthday Party Disposable Tableware and Dishware (8 Pack), Multi Color, 7"" x 7"".",7.09,Disney Minnie
"Kwik Stix Fast-Drying Neon Solid Tempera Paint, 72 Pack, Assorted Neon Colors, 3.5"" (TPG-626)",51.47,Kwik Stix
"Thermee Micro Flannel Sheet Set, King, Bike Ride",55.5,Thermee Micro
Bandai Hobby Sdcs #11 Ground Gundam 08th MS Team,13.37,Bandai Hobby Sdcs
"Melissa & Doug Wooden Jigsaw Puzzle arm, Construction, Pets Puzzle (24 Piece)",23.67,Melissa & Doug
Learning Advantage Magnetic Dry Erase Straight Edge - 24” - Jumbo Teaching Ruler - Measurement Tool for Whiteboards and Chalkboards,15.49,Whiteboards
Little Tikes Cozy Swing,29.99,Little Tikes
Power Rangers Action Vinyls Collectible Action Figures by The Loyal Subjects (Amazon Exclusive),29.95,Amazon Exclusive
Castles of Mad King Ludwig Secrets,29.95,Castles of Mad
Watchover Voodoo Star Warrior Toy,8.97,Watchover Voodoo
Schleich North America Accountant Smurf Toy Figure,6.99,Schleich North
Ruffneck Scarves Red and White Bar Scarf,24.37,Ruffneck Scarves
Moore Ideal Products 13270 Race Duty Steel CVD Kit - Rear - Traxxas Slash 4x4 - Stampede 4x4 - Rally,54.35,Moore Ideal
Magic: The Gathering Ravnica Allegiance Guild Kits | 5 Ready-To-Play 60-Card Decks | Accessories | Factory Sealed,92.18,
"Vintage Parts 14558 3"" Green Fuzzy Dice with White Dots - Pair",7.21,Vintage
"Hygloss Products Blank Jigsaw Puzzle – Compoz-A-Puzzle – 5.5 x 8 Inch - 12 Pieces, 8 Puzzles with Envelopes",11.84,Hygloss Products
Swimline SunChaser Sling Style Lounge Pool Float - 10000M,74.82,Swimline
"Energen DroneMax MA18A Drone Battery Charger, DJI Mavic Air Accessories, Intelligent Fast Multi Battery Charging Hub Station (Charge 3 Batteries & 2 USB Ports Simultaneously)",49.99,Energen DroneMax
Jack Dempsey Children's Stamped Pillowcase with White Perle Edge 1/Pkg-Noah's Ark,7.3,Jack Dempsey
"G.L.O.W. Poi LED - Go Light Our Word! 1 Light Stick, Multi-Color, 7""",19.99,Multi-Color
Squadron Products Precision Glue Applicator,9.99,Squadron
Ceaco Crowd Pleasers Collection by Jan Van Haasteren The Beach Puzzle (1000 Piece),25.5,Ceaco Crowd
"Melissa & Doug Jumbo Coloring & Reusable Sticker Pad 2 Pack – Animal Coloring, Farm Stickers, 14” X 11” Each",9.99,Farm Stickers
"Melissa & Doug Mine to Love Brianna, 12-Inch Soft-Body Baby Doll, Two-Piece Outfit, Wipe-Clean Arms & Legs, 12.5″ H × 7.5″ W × 4.75″ L",19.99,Melissa & Doug Mine
"Beast Kingdom DS-018 Sorcerer'S Apprentice D-Stage Series Statue, 6"", Multicolor",28.33,Beast Kingdom
"Aurora World YooHoo Plush Toy Animal, Camel Chameleon",29.99,Aurora World
Original 3D Crystal Puzzle - London Bus,10.99,Original 3D
"TruJump 40"" Mini Trampoline",73.99,TruJump
Manhattan Toy Natural Historian Opposites Padded Cover Baby and Toddler Board Book,7.99,Toddler Board Book
"Melissa & Doug On The Go Water Wow! Adventure Activity Pad (Reusable Water-Reveal Coloring Book, Refillable Water Pen, Great Gift for Girls and Boys - Best for 3, 4, 5, 6, and 7 Year Olds)",4.99,Melissa & Doug
"American Greetings Pokemon Add-an-Age Banner, 1 Pieces, Made from Vinyl, Birthday, by Amscan",7.37,American Greetings
Daron Worldwide Trading DC Metro Bus,24.95,Daron Worldwide
"Funko 289 Animation: Pop! Rocky & Bullwinkle Collectors Magician Bullwinkle, Flying Rocky, Bullwinkle Fearlessleader, Set",6.89,Rocky & Bullwinkle
Modern Happy Halloween Burlap Banner,7.04,Burlap Banner
"Darice 9193-02 Premium Wood Kit, Stagecoach",5.35,Darice 9193-02
Berenguer Boutique 30050 TWINS- 15” Soft Body Baby Dolls - 12 Piece Gift Set with Open/Close Eyes- Perfect for Children 2+,39.99,Berenguer Boutique
"HANSA - Spinosaurus 28"", Gray",63.49,HANSA -
"Creative Converting 101155 Picks Candle, 3"", Multicolored",3.99,Creative
"Swagtron EB-8 Outlaw Fat Tire Electric Bike – Foldable Off-Road Fat eBike 20-inch Wheels with Power Assist, Freehub and Shimano 7-Speed Gear Shifts, Black, Large",799.99,Power Assist
"Royal and Langnickel Colour by Number Pencil, Jungle Animals",5.2,Royal and
PROLINE 344100 Ram 2500 Clear Body,47.09,PROLINE 344100
"Gamma Beginner Child or Adult Training (Transition) Practice Tennis Balls: Orange or Green Dot, Quick Kids 36, 60, or 78 (25%-50% Slower Ball Speed) - 12, 36, 48, 60 Pack Sizes",60.0,Gamma Beginner
"Razor Agitator BMX/Freestyle Bike, 20-Inch",179.99,Razor Agitator
348716 Fabric Carpet Floor Runner 15' X 2' Red,21.44,
Flutter Friends Hummingbird Nectar,3.97,Flutter Friends
-,13.0,
Nerf Modulus Stealth Ops Upgrade Kit,14.95,Nerf Modulus Stealth
Funko Pop! Television: Club De Cuervos - Chava Iglesias Jr,7.95,Funko
HQ Kites Monarch L Butterfly Kite 50 Inch Single - Line Kite with Tail - Active Outdoor Fun for Ages 5 and Up,27.99,HQ Kites Monarch
Marine Life Props Party Accessory (1 count) (16/Pkg),6.85,Marine Life
JA-RU Classic Yoyo Game Toy Professional Yo-Yos (8 Pack Assorted Colors) . Yoyos for Kids Pinata Filler Gifts Ideas for Party Favors in Bulk | | Item # 1986-8p,19.54,JA-RU Classic
Krosmaster: Expansion #3 - Percimol Rules,4.23,
"WEmake Rosen Core Lead Free Solder, 1 lb",43.94,WEmake Rosen
Jameco Kitpro CJKIT-21110 DIY Robotic Hand Shadow Kit,89.95,Jameco Kitpro
"Ultra Pro Gaming Generic 84670 Deck Box, Multi, One Size",5.99,Ultra Pro Gaming
Dinosaurs Motivational Stickers,6.01,Dinosaurs
"Munchkin Ocean Squirts Bath Toy, 8 pack",8.99,Munchkin Ocean
Team Redcat CNC Machined Stainless Chassis Guard-Rear,31.98,Team Redcat CNC
Calico Critters Town Girl Series - Toy Poodle -,11.02,Calico Critters
"Melissa & Doug Examine & Treat Pet Vet Play Set - The Original (Kids Toy Best for 3, 4, 5 Year Olds and Up) & Veterinarian Role-Play Costume Set, Machine-Washable, 17.5” H x 24” W x 0.75” L",46.8,Melissa & Doug
Marvel Retro 6-inch Collection Iron Man Figure,13.99,Marvel
"Metallic Bead Necklaces, Party Accessory",9.53,Metallic Bead Necklaces
McFarlane Toys Borderlands - Psycho Action Figure,16.73,McFarlane Toys
"Ertl John Deere 850K Diecast Dozer, 1:50-Scale",40.56,Ertl John
MasterPieces Farmall Forever Red 1000 Piece Tin Box Jigsaw Puzzle by Charles Freitag,14.71,MasterPieces
"Century Drill & Tool 92913 Rethreading Hexagon Die, 5/8-11 NC",12.63,Century Drill &
Beistle CN070 Sweet 16 Confetti,5.98,Beistle CN070
"Mega Bloks ABC Musical Train Building Set, 50 pieces",25.98,Mega Bloks ABC
DreamWorks Spirit Riding Free Collector Doll & Horse - Ursula & Bing Cherry,14.99,DreamWorks
"C&D Visionary"" DC Comics Batman Logo 4pcs Mini Gold Metal Set sticker, 1"" x 1.5"" - S-DC-0145-M-S",4.99,C&D
"SHIMMEEZ, Large Size Yaffa Unicorn, Sequin Plush Stuffed Animal, 3.5""",13.19,SHIMMEEZ
"Melissa & Doug Peg Puzzles Set, Farm Animals, Pets, Ocean (3 Peg Puzzles, Best for 2, 3, and 4 Year Olds) & Disney Classics Alphabet Wooden Peg Puzzle (26 Pieces, Best for 3, 4, 5 Year Olds and Up)",37.98,Melissa & Doug
Folkmanis Mini Eagle Finger Puppet,8.49,Folkmanis Mini
NATIONAL GEOGRAPHIC Argentinosaurus Plush,29.99,NATIONAL
Pulchra Ssss.Gridman: Rikka Takarada 1: 6 Scale PVC Figure,180.3,Pulchra
Redcat Racing SH .28 Drill Start Backing Plate,15.86,Redcat Racing
WWE Micro Maniax Battle Game with Two Bonus Figures,23.53,WWE Micro Maniax Battle Game
Funko POP Disney Day of The Dead Jack Skellington Action Figure,10.99,Funko POP Disney
Rubie's Costume Men's Batman Arkham City Adult Robin Top,18.0,Rubie's Costume
Globber Primo Plus Lights V2 442,73.43,Globber Primo
Epic Spell Wars of The Battle Wizards: Duel at Mt. Skullzfyre,25.63,Epic Spell
"Fisher-Price Imaginext DC Super Friends, Battle Batcave",19.99,Fisher-Price
Steve Jackson Games Ogre Battle Box,58.1,Steve Jackson
"Excellerations Math Manipulatives Set of 108 Farm Animal Counters 1.5"" -2"", STEM Educational Toy for Mathematics, Preschool",28.92,Excellerations
"Classic Accessories RV Toy Hauler Trailer Tailgate Bug/Shade Adjustable Screen, Aluminum/Fiberglass Frame",185.0,Classic Accessories
Kidzaw Master Kitz The Starry Night by Vincent Van Gogh,10.75,Kidzaw Master
Cat Accessory Kit,5.04,Cat Accessory
Funko POP Disney: Kingdom Hearts Mickey Toy Figures,9.4,Funko POP
"Gundam The Origin Zaku II Type C-6/R6, Bandai HG The Origin 1/144",25.0,Gundam The
Q-Workshop Polyhedral 7-Die Set: Carved Steampunk Dice Set (Yellow and Black),15.0,Q-Workshop
Learning Advantage Four-Color Spinners - Set of 5 - Game Spinner - Write On/Wipe Off Surface for Multiple Uses,5.67,Learning
Funko Pop Movies: Silence of The Lambs - Hannibal,7.84,Funko Pop
"ICS CIS 1:32 Die Cast Transformable Car to Robot with Sound/Light Vehicle, Yellow",18.14,CIS
Busch 1512 Farm Shop HO Structure Scale Model Structure,29.31,Busch 1512 Farm
CREATIVE ROOTS Paint Your Own Fairy Door by Horizon Group USA,14.59,Horizon Group USA
"Brybelly 12 Blue Decks Standard Playing Cards by Brybelly (Wide-Size, Regular Index)",14.99,Wide-Size
Slugfest Games Red Dragon Inn: Allies - Ozrik The Adept (Red Dragon Inn Expansion) Board Game,13.83,Slugfest Games
"MasterPieces Colorscapes Linen Jigsaw Puzzle, It's Amore! Romantic Evening in Italy, 1000 Pieces",13.39,MasterPieces
"Itzy Ritzy Silicone Teething Mitt – Soothing Infant Teething Mitten with Adjustable Strap, Crinkle Sound and Textured Silicone to Soothe Sore and Swollen Gums, Cactus",8.99,Cactus
Trends International Trolls - Poppy - 4 Color Decal 4 X 8,9.51,Trends
Ghostbusters The Board Game,33.55,Ghostbusters The
amscan Thanskgiving White Pilgrim Girl Set | Party Costume,5.35,
FREEing Reborn!: Kyoya Hibari Nendoroid Action Figure,33.95,FREEing
Pokeno 2,15.01,
"Redcat Racing RER11413 Aluminum Transfer Case Drive Shaft, Silver",16.99,Redcat Racing
"Moonlite - Special Edition Eric Carle Gift Pack, Storybook Projector for Smartphones with 5 Story Reels, for Ages 1 & Up",27.2,Moonlite - Special Edition
"DCI Pop Quiz Clock, Black and White, Metal, 11-1/2"" Diameter, Mathematics Teacher Gift, Wall Clock for Classroom, Home, Office",22.29,Pop Quiz Clock
Funko POP TV: Scrubs - Elliot,9.99,Scrubs - Elliot
Kan Jam Illuminate Ultra-Bright LED Light-Up Glow Volleyball (Official Size and Weight),24.95,Kan Jam
"VTech Touch and Swipe Baby Phone, Blue",12.49,VTech
Spiderman Far from Home Laser-Tag for Kids Infared Lazer-Tag Blasters Lights Up & Vibrates When Hit (Frustration Free Packaging),23.94,Spiderman
Tic Tac Two – Strategy-Based Board Game for Families,11.67,Tic Tac
"Darice 9110-40 Wood Script Word, Faith",3.52,Darice 9110-40
"The Northwest Company Disney Phineas & Ferb Action Agent Character Fleece Throw Blanket, 40 x 50-inches",19.99,The Northwest
CMON Zombicide: Zombie Dogs Board Game (5 Set),24.99,CMON Zombicide
amscan Invitations | Yo Gabba Gabba Collection | Party Accessory,7.67,Party Accessory
Kodak 1500 Piece - Quaint Cottage by The Sea,14.99,Kodak
Disney Pixar Cars Deluxe Frank,17.19,Disney Pixar Cars Deluxe
Plush Black & White Jester Hats Party Accessory (1 count) (1/Pkg),19.99,Plush Black &
"Swing Set Stuff Inc. Commercial Polymer Belt Seat with SSS Logo Sticker Playground Accessory, Blue",33.74,Swing Set Stuff
DREAMWORKS TROLLS Hair Raising Tiny Smidge,4.09,DREAMWORKS
Kangaroo Trading Co. Classic Grab-n-go Foam Chair,59.88,Kangaroo Trading
"Westcott 7-Inch KleenEarth Soft Handle Straight Scissors, Black/Gray",10.97,Black/Gray
"Crayola Epic Book of Awesome, All-in-One Coloring Book Set, 288 Animal Coloring Pages, Gift for Kids, Age 3, 4, 5, 6, Multi",4.97,Crayola Epic
"Young Heroes Child's Fire Fighter Costume, Small",21.53,Young Heroes
Line 6 Sonic Port VX Audio I/O and Stereo Microphone,195.2,Line 6 Sonic
Ravensburger Disney Incredibles 2 - 200 Piece Panorama Puzzle,13.7,Panorama Puzzle
"Rose Levy Beranbaum Signature Series RPK001 Rose's All American Pie Kit Includes Rolling Pin, Mat and Fast Tracks Dough Thickness Rails, 18"" x 24.5"", Red",54.99,Rose Levy
Estes 7263 Flying Model Rocket Kit Hex-3,9.84,Estes 7263
Funko Pop! - Funkoverse Strategy Game: DC #100 - Base Set,22.49,Funko
White Mountain Puzzles Great Paintings - 1000 Piece Jigsaw Puzzle,16.34,White Mountain
Barbie Star Trek 50th Anniversary Kirk Doll,32.53,Barbie Star Trek
Powell Attic Cherry Bed Steps,29.72,Powell Attic
Learning Resources Pan Balance,18.93,Learning
Cra-Z-Art Shimmer and Sparkle Color Craze Fringe Messenger Bag,16.52,Cra-Z-Art Shimmer
Melissa & Doug Track & Rescue Safari Animals Play Set with 3 Plush Stuffed Animals (30 Pcs),18.97,Melissa & Doug Track & Rescue
"Pop The Pig Pop N Race, Kids Game",9.74,Pop The Pig Pop
"Melissa & Doug Occupations Magnetic Dress-Up Wooden Dolls Pretend Play Set (73 Pieces, Great Gift for Girls and Boys - Best for 3, 4, 5, 6, and 7 Year Olds)",19.99,Melissa & Doug
LOZ Kuala Lumpur Tower Building Blocks,25.77,LOZ Kuala Lumpur
"Ferrari Collapsible Two Wheels Scooter with Free Backpack, White",149.99,Ferrari
Sweet Jojo Designs Black and Blush Pink Shabby Chic Watercolor Floral Girl Twin Kids Children's Bedding Comforter Set-4 Pieces-Rose Flower,39.99,Sweet Jojo
SE ML7527L Illuminated Adjustable-Focus Loupe with 8X Magnification,7.99,SE ML7527L
"Star Wars Child's Deluxe Yoda Costume, Medium",23.47,Star Wars
Funko Pop! TV: Community - Ben Chang,8.1,Funko
Pandemic,34.23,
"Discovery Build & Color Your Own Glowing Volcano by Horizon Group USA, Great Stem Science Kit, Perform Science Fair Experiments with DIY Fizzy & Lava Eruptions",13.69,Horizon Group USA
BalanceFrom 2.3-Inch Phthalate Free BPA Free Non-Toxic Crush Proof Play Balls Pit Balls- 6 Bright Colors in Reusable and Durable Storage Mesh Bag with Zipper,19.99,
NJ Croce Gumby Bendable Figure,9.09,NJ Croce Gumby Bendable
DC Collectibles Aquaman Movie: Mera Resin Statue,99.95,DC Collectibles Aquaman
Adora 20254002   Doll & Fishytime Bundle,37.86,Adora 20254002
"Fisher-Price Nickelodeon Shimmer & Shine, Minu",7.63,Fisher-Price
Hot Wings Continental Airlines Md DC-10 Jet with Connectible Runway,6.99,Hot Wings
Mega Construx Pokemon Blastoise,23.89,Mega Construx
"Bachmann Steam Locomotive, Prototypical paint scheme",94.43,Bachmann Steam Locomotive
Battat – Wooden Passenger Trains – Classic & Compatible Wooden Toy Train Car Accessories for Kids & Collectors Aged 3 Years Old & Up (6Pc),12.99,
"Barbie Dreamtopia Mermaid Doll, Coral Hair",9.99,Barbie
Quercetti Kaleido Gears - 55 Piece Building Set with 3 Different Sized Gears,27.99,Quercetti
Fur Babies World DREAMSTARS - Kiki,4.6,Fur Babies World
Beast Kingdom The Little Mermaid Ds-012 D-Stage Series Statue,25.79,Beast Kingdom
Foil Snowflake Danglers (2/Pkg),13.35,Foil Snowflake
"Franklin Sports 8.5"" Rubber Tetherball",14.99,Rubber Tetherball
WowWee Untamed Radioactive Raptor - Gamma (Red) - Interactive Toy,10.03,WowWee Untamed
"Melissa & Doug Smarty Pants Kindergarten Card Set (Trivia Games, Educational Card Set for Kids, Developed with Educators, 120 Cards, Great Gift for Girls and Boys - Best for 5, 6, and 7 Year Olds)",12.49,Melissa & Doug Smarty
Max Factory Fate/Grand Order: Master/Female Protagonist Figma Action Figure,64.98,Max Factory
"Party Essentials N81004 8-Ounce Hard Plastic Coffee Cups, 10-Count, White",5.82,Party Essentials
Carson-Dellosa Key Education Textured Touch and Trace: Lowercase Manipulative (846012),15.99,Trace
"Darice 9199-40 Natural Painted Wood Cutout, Two Palm Tree",5.41,Darice 9199-40
"Rubies Costume Star Wars Collection Pet Costume, Princess Leia",18.86,Rubies Costume
Brainwright Disney Deluxe Cube Minnie Mouse Puzzle (850 Piece),12.43,Disney Deluxe
"Green Toys TRNRG-1293 Train, Red/Green",17.28,Green Toys
Indie Boards and Cards Flash Point Fire Rescue Urban Structures,14.99,Indie Boards
"Tru-Ray Heavyweight Construction Paper, Hot Assorted Colors, 12"" x 18"", 50 Sheets",10.01,Hot Assorted Colors
"Rollerblade Macroblade 80 ABT Women's Adult Fitness Inline Skate, Black and Purple, Performance Inline Skates",249.99,Rollerblade
"Cosco Blossom 3 Bin Storage Unit, Pink/White",19.99,Pink/White
Revell Fast & Furious 69 Chevy Yenko Camaro Model Kit,26.99,Revell Fast & Furious
Denver Nuggets 3D Brxlz - Logo,19.99,Denver Nuggets
"Little Buddy Official Kirby Adventure Animal Kirby 5.5"" Plush Doll",14.14,Little Buddy
"Star Cutouts | Gold | 9"" | Party Decor | 40 Ct.",28.22,Star Cutouts
Rubie's Costume Reel F/X Raw Meat Open Wound Kit,11.0,Rubie's Costume
"Monster High Sweet 1600 Deluxe Frankie Stein Costume, Large",17.35,Monster High
